Name,Abstraction,Status,Description,Alternate Terms,Likelihood Of Attack,Typical Severity,Related Attack Patterns,Execution Flow,Prerequisites,Skills Required,Resources Required,Indicators,Consequences,Mitigations,Example Instances,Related Weaknesses,Taxonomy Mappings,Notes
Parameter Injection,Meta,Stable,"An adversary manipulates the content of request parameters for the purpose of undermining the security of the target. Some parameter encodings use text characters as separators. For example, parameters in a HTTP GET message are encoded as name-value pairs separated by an ampersand (&). If an attacker can supply text strings that are used to fill in these parameters, then they can inject special characters used in the encoding scheme to add or modify parameters. For example, if user input is fed directly into an HTTP GET request and the user provides the value myInput&new_param=myValue, then the input parameter is set to myInput, but a new parameter (new_param) is also added with a value of myValue. This can significantly change the meaning of the query that is processed by the server. Any encoding scheme where parameters are identified and separated by text characters is potentially vulnerable to this attack - the HTTP GET encoding used above is just one example.",,Medium,Medium,,,"::The target application must use a parameter encoding where separators and parameter identifiers are expressed in regular text.::The target application must accept a string as user input, fail to sanitize characters that have a special meaning in the parameter encoding, and insert the user-supplied string in an encoding which is then processed.::",,::None: No specialized resources are required to execute this type of attack. The only requirement is the ability to provide string input to the target.::,,::SCOPE:Integrity:TECHNICAL IMPACT:Modify Data:NOTE:Successful parameter injection attacks mean a compromise to integrity of the application.::,"::Implement an audit log written to a separate host. In the event of a compromise, the audit log may be able to provide evidence and details of the compromise.::Treat all user input as untrusted data that must be validated before use.::",,::88::,,
Content Spoofing,Meta,Stable,"An adversary modifies content to make it contain something other than what the original content producer intended while keeping the apparent source of the content unchanged. The term content spoofing is most often used to describe modification of web pages hosted by a target to display the adversary's content instead of the owner's content. However, any content can be spoofed, including the content of email messages, file transfers, or the content of other network communication protocols. Content can be modified at the source (e.g. modifying the source file for a web page) or in transit (e.g. intercepting and modifying a message between the sender and recipient). Usually, the adversary will attempt to hide the fact that the content has been modified, but in some cases, such as with web site defacement, this is not necessary. Content Spoofing can lead to malware exposure, financial fraud (if the content governs financial transactions), privacy violations, and other unwanted outcomes.",,Medium,Medium,,,"::The target must provide content but fail to adequately protect it against modification.The adversary must have the means to alter data to which they are not authorized. If the content is to be modified in transit, the adversary must be able to intercept the targeted messages.::",,"::If the content is to be modified in transit, the adversary requires a tool capable of intercepting the target's communication and generating/creating custom packets to impact the communications. In some variants, the targeted content is altered so that all or some of it is redirected towards content published by the attacker (for example, images and frames in the target's web site might be modified to be loaded from a source controlled by the attacker). In these cases, the attacker requires the necessary resources to host the replacement content.::",,::SCOPE:Integrity:TECHNICAL IMPACT:Modify Data:NOTE:A successful content spoofing attack compromises the integrity of the application data.::,,,::345::,TAXONOMY NAME:ATTACK:ENTRY ID:1491:ENTRY NAME:Defacement::::TAXONOMY NAME:WASC:ENTRY ID:12:ENTRY NAME:Content Spoofing::::TAXONOMY NAME:OWASP Attacks:ENTRY NAME:Content Spoofing::,
Identity Spoofing,Meta,Stable,"Identity Spoofing refers to the action of assuming (i.e., taking on) the identity of some other entity (human or non-human) and then using that identity to accomplish a goal. An adversary may craft messages that appear to come from a different principle or use stolen / spoofed authentication credentials.",,Medium,Medium,,,::The identity associated with the message or resource must be removable or modifiable in an undetectable way.::,,::None: No specialized resources are required to execute this type of attack.::,,::SCOPE:Confidentiality:SCOPE:Integrity:SCOPE:Authentication:SCOPE:Access Control:TECHNICAL IMPACT:Gain Privileges::,"::Employ robust authentication processes (e.g., multi-factor authentication).::",,::287::,,
Input Data Manipulation,Meta,Draft,"An attacker exploits a weakness in input validation by controlling the format, structure, and composition of data to an input-processing interface. By supplying input of a non-standard or unexpected form an attacker can adversely impact the security of the target.",,,Medium,,,::The target must accept user data for processing and the manner in which this data is processed must depend on some aspect of the format or flags that the attacker can control.::,,::None: No specialized resources are required to execute this type of attack.::,,,,,::20::,,
Resource Location Spoofing,Meta,Stable,"An adversary deceives an application or user and convinces them to request a resource from an unintended location. By spoofing the location, the adversary can cause an alternate resource to be used, often one that the adversary controls and can be used to help them achieve their malicious goals.",,Medium,Medium,,,"::None. All applications rely on file paths and therefore, in theory, they or their resources could be affected by this type of attack.::",,::None: No specialized resources are required to execute this type of attack.::,,::SCOPE:Authorization:TECHNICAL IMPACT:Execute Unauthorized Commands:NOTE:Run Arbitrary Code::,::Monitor network activity to detect any anomalous or unauthorized communication exchanges.::,,::451::,,
Infrastructure Manipulation,Meta,Draft,"An attacker exploits characteristics of the infrastructure of a network entity in order to perpetrate attacks or information gathering on network objects or effect a change in the ordinary information flow between network objects. Most often, this involves manipulation of the routing of network messages so, instead of arriving at their proper destination, they are directed towards an entity of the attackers' choosing, usually a server controlled by the attacker. The victim is often unaware that their messages are not being processed correctly. For example, a targeted client may believe they are connecting to their own bank but, in fact, be connecting to a Pharming site controlled by the attacker which then collects the user's login information in order to hijack the actual bank account.",,,High,::NATURE:CanPrecede:CAPEC ID:664::,,"::The targeted client must access the site via infrastructure that the attacker has co-opted and must fail to adequately verify that the communication channel is operating correctly (e.g. by verifying that they are, in fact, connected to the site they intended.)::",,"::The attacker must be able to corrupt the infrastructure used by the client. For some variants of this attack, the attacker must be able to stand up their own services that mimic the services the targeted client intends to use.::",,,,,::923::,,
File Manipulation,Meta,Draft,"An attacker modifies file contents or attributes (such as extensions or names) of files in a manner to cause incorrect processing by an application. Attackers use this class of attacks to cause applications to enter unstable states, overwrite or expose sensitive information, and even execute arbitrary code with the application's privileges. This class of attacks differs from attacks on configuration information (even if file-based) in that file manipulation causes the file processing to result in non-standard behaviors, such as buffer overflows or use of the incorrect interpreter. Configuration attacks rely on the application interpreting files correctly in order to insert harmful configuration information. Likewise, resource location attacks rely on controlling an application's ability to locate files, whereas File Manipulation attacks do not require the application to look in a non-default location, although the two classes of attacks are often combined.",,,Medium,,,::The target must use the affected file without verifying its integrity.::,,"::None: No specialized resources are required to execute this type of attack. In some cases, tools can be used to better control the response of the targeted application to the modified file.::",,,,,,TAXONOMY NAME:ATTACK:ENTRY ID:1036.003:ENTRY NAME:Masquerading: Rename System Utilities::,
Footprinting,Meta,Stable,An adversary engages in probing and exploration activities to identify constituents and properties of the target.,,High,Very Low,,"::STEP:1:PHASE:Explore:DESCRIPTION:[Request Footprinting] The attacker examines the website information and source code of the website and uses automated tools to get as much information as possible about the system and organization.:TECHNIQUE:Open Source Footprinting: Examine the website about the organization and skim through the webpage's HTML source to look for comments.:TECHNIQUE:Network Enumeration: Perform various queries (Registrar Query, Organizational Query, Domain Query, Network Query, POC Query) on the many whois databases found on the internet to identify domain names and associated networks.:TECHNIQUE:DNS Interrogation: Once basic information is gathered the attack could begin to query DNS.:TECHNIQUE:Other Techniques: Use ping sweep, TCP scan, UDP scan, OS Identification various techniques to gain more information about the system and network.::","::An application must publicize identifiable information about the system or application through voluntary or involuntary means. Certain identification details of information systems are visible on communication networks (e.g., if an adversary uses a sniffer to inspect the traffic) due to their inherent structure and protocol standards. Any system or network that can be detected can be footprinted. However, some configuration choices may limit the useful information that can be collected during a footprinting attack.::","::SKILL:The adversary knows how to send HTTP request, run the scan tool.:LEVEL:Low::",::The adversary requires a variety of tools to collect information about the target. These include port/network scanners and tools to analyze responses from applications to determine version and configuration information. Footprinting a system adequately may also take a few days if the attacker wishes the footprinting attempt to go undetected.::,,::SCOPE:Confidentiality:TECHNICAL IMPACT:Read Data::,"::Keep patches up to date by installing weekly or daily if possible.::Shut down unnecessary services/ports.::Change default passwords by choosing strong passwords.::Curtail unexpected input.::Encrypt and password-protect sensitive data.::Avoid including information that has the potential to identify and compromise your organization's security such as access to business plans, formulas, and proprietary documents.::","::In this example let us look at the website http://www.example.com to get much information we can about Alice. From the website, we find that Alice also runs foobar.org. We type in www example.com into the prompt of the Name Lookup window in a tool, and our result is this IP address: 192.173.28.130 We type the domain into the Name Lookup prompt and we are given the same IP. We can safely say that example and foobar.org are hosted on the same box. But if we were to do a reverse name lookup on the IP, which domain will come up? www.example.com or foobar.org? Neither, the result is nijasvspirates.org. So nijasvspirates.org is the name of the box hosting 31337squirrel.org and foobar.org. So now that we have the IP, let's check to see if nijasvspirates is awake. We type the IP into the prompt in the Ping window. We'll set the interval between packets to 1 millisecond. We'll set the number of seconds to wait until a ping times out to 5. We'll set the ping size to 500 bytes and we'll send ten pings. Ten packets sent and ten packets received. nijasvspirates.org returned a message to my computer within an average of 0.35 seconds for every packet sent. nijasvspirates is alive. We open the Whois window and type nijasvspirates.org into the Query prompt, and whois.networksolutions.com into the Server prompt. This means we'll be asking Network Solutions to tell us everything they know about nijasvspirates.org. The result is this laundry list of info: Registrant: FooBar (nijasvspirates -DOM) p.o.box 11111 SLC, UT 84151 US Domain Name: nijasvspirates.ORG Administrative Contact, Billing Contact: Smith, John jsmith@anonymous.net FooBar p.o.box 11111 SLC, UT 84151 555-555-6103 Technical Contact: Johnson, Ken kj@fierymonkey.org fierymonkey p.o.box 11111 SLC, UT 84151 555-555-3849 Record last updated on 17-Aug-2001. Record expires on 11-Aug-2002. Record created on 11-Aug-2000. Database last updated on 12-Dec-2001 04:06:00 EST. Domain servers in listed order: NS1. fierymonkey.ORG 192.173.28.130 NS2. fierymonkey.ORG 64.192.168.80 A corner stone of footprinting is Port Scanning. Let's port scan nijasvspirates.org and see what kind of services are running on that box. We type in the nijasvspirates IP into the Host prompt of the Port Scan window. We'll start searching from port number 1, and we'll stop at the default Sub7 port, 27374. Our results are: 21 TCP ftp 22 TCP ssh SSH-1.99-OpenSSH_2.30 25 TCP smtp 53 TCP domain 80 TCP www 110 TCP pop3 111 TCP sunrpc 113 TCP ident Just by this we know that Alice is running a website and email, using POP3, SUNRPC (SUN Remote Procedure Call), and ident.::",::200::,TAXONOMY NAME:ATTACK:ENTRY ID:1217:ENTRY NAME:Browser Bookmark Discovery::::TAXONOMY NAME:ATTACK:ENTRY ID:1592:ENTRY NAME:Gather Victim Host Information::::TAXONOMY NAME:ATTACK:ENTRY ID:1595:ENTRY NAME:Active Scanning::,
DEPRECATED: Variable Manipulation,Meta,Deprecated,This attack pattern has been deprecated as it is a duplicate of the existing attack pattern CAPEC-77 : Manipulating User-Controlled Variables. Please refer to this other CAPEC going forward.,,,,,,,,,,,,,,,
Action Spoofing,Meta,Stable,"An adversary is able to disguise one action for another and therefore trick a user into initiating one type of action when they intend to initiate a different action. For example, a user might be led to believe that clicking a button will submit a query, but in fact it downloads software. Adversaries may perform this attack through social means, such as by simply convincing a victim to perform the action or relying on a user's natural inclination to do so, or through technical means, such as a clickjacking attack where a user sees one interface but is actually interacting with a second, invisible, interface.",,High,Very High,,,::The adversary must convince the victim into performing the decoy action.::The adversary must have the means to control a user's interface to present them with a decoy action as well as the actual malicious action. Simple versions of this attack can be performed using web pages requiring only that the adversary be able to host (or control) content that the user visits.::,,,,::SCOPE:Confidentiality:SCOPE:Integrity:SCOPE:Availability:TECHNICAL IMPACT:Other:NOTE:Action spoofing can result in a wide variety of consequences and negatively affect all three elements of the security triad.::,"::Avoid interacting with suspicious sites or clicking suspicious links.::An organization should provide regular, robust cybersecurity training to its employees.::",,::451::,,
Code Inclusion,Meta,Stable,"An adversary exploits a weakness on the target to force arbitrary code to be retrieved locally or from a remote location and executed. This differs from code injection in that code injection involves the direct inclusion of code while code inclusion involves the addition or replacement of a reference to a code file, which is subsequently loaded by the target and used as part of the code of some application.",,Medium,Very High,,,"::The target application must include external code/libraries that are executed when the application runs and the adversary must be able to influence the specific files that get included.::The victim must run the targeted application, possibly using the crafted parameters that the adversary uses to identify the code to include.::",,::The adversary may need the capability to host code modules if they wish their own code files to be included.::,,,,::One example of this type of attack pattern is PHP file include attacks where the parameter of an include() function is set by a variable that an attacker is able to control. The result is that arbitrary code could be loaded into the PHP application and executed.::,::829::,,
Configuration/Environment Manipulation,Meta,Draft,"An attacker manipulates files or settings external to a target application which affect the behavior of that application. For example, many applications use external configuration files and libraries - modification of these entities or otherwise affecting the application's ability to use them would constitute a configuration/environment manipulation attack.",,,Medium,,,::The target application must consult external files or configuration controls to control its execution. All but the very simplest applications meet this requirement.::,,::The attacker must have the access necessary to affect the files or other environment items the targeted application uses for its operations.::,,,,,::15::1233::1234::1304::1328::,TAXONOMY NAME:OWASP Attacks:ENTRY NAME:Setting Manipulation::,
Software Integrity Attack,Meta,Draft,"An attacker initiates a series of events designed to cause a user, program, server, or device to perform actions which undermine the integrity of software code, device data structures, or device firmware, achieving the modification of the target's integrity to achieve an insecure state.",,,Low,,,,::SKILL:Manual or user-assisted attacks require deceptive mechanisms to trick the user into clicking a link or downloading and installing software. Automated update attacks require the attacker to host a payload and then trigger the installation of the payload code.:LEVEL:Medium::,"::Software Integrity Attacks are usually a late stage focus of attack activity which depends upon the success of a chain of prior events. The resources required to perform the attack vary with respect to the overall attack strategy, existing countermeasures which must be bypassed, and the success of early phase attack vectors.::",,,,,::494::,,
Reverse Engineering,Meta,Stable,"An adversary discovers the structure, function, and composition of an object, resource, or system by using a variety of analysis techniques to effectively determine how the analyzed entity was constructed or operates. The goal of reverse engineering is often to duplicate the function, or a part of the function, of an object in order to duplicate or back engineer some aspect of its functioning. Reverse engineering techniques can be applied to mechanical objects, electronic devices, or software, although the methodology and techniques involved in each type of analysis differ widely.",,Low,Low,,,"::Access to targeted system, resources, and information.::","::SKILL:Understanding of low level programming languages or technologies can be very helpful. For example, when reverse engineering a binary file, an understanding of assembly languages can help to determine the purpose and inner-workings of the code. Another example is reverse engineering an application that relies on networking. Here, an understanding networking protocols can provide insight into application details.:LEVEL:High::","::The technical resources necessary to engage in reverse engineering differ in accordance with the type of object, resource, or system being analyzed.::",,,::Employ code obfuscation techniques to prevent the adversary from reverse engineering the targeted entity.::,"::When adversaries are reverse engineering software, methodologies fall into two broad categories, 'white box' and 'black box.' White box techniques involve methods which can be applied to a piece of software when an executable or some other compiled object can be directly subjected to analysis, revealing at least a portion of its machine instructions that can be observed upon execution. 'Black Box' methods involve interacting with the software indirectly, in the absence of the ability to measure, instrument, or analyze an executable object directly. Such analysis typically involves interacting with the software at the boundaries of where the software interfaces with a larger execution environment, such as input-output vectors, libraries, or APIs.::",::1278::,,
Protocol Analysis,Meta,Stable,"An adversary engages in activities to decipher and/or decode protocol information for a network or application communication protocol used for transmitting information between interconnected nodes or systems on a packet-switched data network. While this type of analysis involves the analysis of a networking protocol inherently, it does not require the presence of an actual or physical network.",,Low,Low,,,::Access to a binary executable.::The ability to observe and interact with a communication channel between communicating processes.::,"::SKILL:Knowlegde of the Open Systems Interconnection model (OSI model), and famililarity with Wireshark or some other packet analyzer.:LEVEL:High::","::Depending on the type of analysis, a variety of tools might be required, such as static code and/or dynamic analysis tools. Alternatively, the effort might require debugging programs such as ollydbg, SoftICE, or disassemblers like IDA Pro. In some instances, packet sniffing or packet analyzing programs such as TCP dump or Wireshark are necessary. Lastly, specific protocol analysis might require tools such as PDB (Protocol Debug), or packet injection tools like pcap or Nemesis.::",,::SCOPE:Confidentiality:TECHNICAL IMPACT:Read Data:NOTE:Successful deciphering of protocol information compromises the confidentiality of future sensitive communications.::SCOPE:Integrity:TECHNICAL IMPACT:Modify Data:NOTE:Modifying communications after successful deciphering of protocol information compromises integrity.::,,,::326::,,"TYPE:Other:NOTE:There are several challenges inherent to protocol analysis depending upon the nature of the protocol being analyzed. There may also be other types of factors which complicate the process such as encryption or ad hoc obfuscation of the protocol. In general there are two kinds of networking protocols, each associated with its own challenges and analysis approaches or methodologies. Some protocols are human-readable, which is to say they are text-based protocols. Examples of these types of protocols include HTTP, SMTP, and SOAP. Additionally, application-layer protocols can be embedded or encapsulated within human-readable protocols in the data portion of the packet. Typically, human-readable protocol implementations are susceptible to automatic decoding by the appropriate tools, such as Wireshark/ethereal, tcpdump, or similar protocol sniffers or analyzers. The presence of well-known protocol specifications in addition to easily identified protocol delimiters, such as Carriage Return or Line Feed characters (CRLF) result in text-based protocols susceptibility to direct scrutiny through manual processes. Protocol analysis against protocol implementations such as HTTP is often performed to identify idiosyncratic implementations of a protocol by a server or client. In the case of application-layer protocols which are embedded within text-based protocols, analysis techniques typically benefit from the well-known nature of the encapsulating protocols and can focus on discovering the semantic characteristics of the proprietary protocol or API, since the syntax and protocol delimiters of the underlying protocols can be readily identified. When performing protocol analysis of machine-readable (non-text-based) protocols difficulties emerge as the protocol itself was designed to be read by computing process. Such protocols are typically composed entirely in binary with no apparent syntax, grammar, or structural boundaries. Examples of these types of protocols are IP, UDP, and TCP. Binary protocols with published specifications can be automatically decoded by protocol analyzers, but in the case of proprietary, closed-specification, binary protocols there are no immediate indicators of packet syntax such as packet boundaries, delimiters, or structure, or the presence or absence of encryption or obfuscation. In these cases there is no one technology that can extract or reveal the structure of the packet on the wire, so it is necessary to use trial and error approaches while observing application behavior based on systematic mutations introduced at the packet-level. Tools such as Protocol Debug (PDB) or other packet injection suites are often employed. In cases where the binary executable is available, protocol analysis can be augmented with static and dynamic analysis techniques.::"
