Name,Abstraction,Status,Description,Alternate Terms,Likelihood Of Attack,Typical Severity,Related Attack Patterns,Execution Flow,Prerequisites,Skills Required,Resources Required,Indicators,Consequences,Mitigations,Example Instances,Related Weaknesses,Taxonomy Mappings,Notes
Exploitation of Trusted Identifiers,Meta,Stable,"An adversary guesses, obtains, or rides a trusted identifier (e.g. session ID, resource ID, cookie, etc.) to perform authorized actions under the guise of an authenticated user or service.",,High,High,,"::STEP:1:PHASE:Explore:DESCRIPTION:[Survey the application for Indicators of Susceptibility] Using a variety of methods, until one is found that applies to the target, the adversary probes for cookies, session tokens, or entry points that bypass identifiers altogether.:TECHNIQUE:Spider all available pages:TECHNIQUE:Attack known bad interfaces:TECHNIQUE:Search outward-facing configuration and properties files for identifiers.::STEP:2:PHASE:Experiment:DESCRIPTION:[Fetch samples] The adversary fetches many samples of identifiers. This may be through legitimate access (logging in, legitimate connections, etc.) or via systematic probing.:TECHNIQUE:An adversary makes many anonymous connections and records the session IDs assigned.:TECHNIQUE:An adversary makes authorized connections and records the session tokens or credentials issued.:TECHNIQUE:An adversary gains access to (legitimately or illegitimately) a nearby system (e.g., in the same operations network, DMZ, or local network) and makes a connection from it, attempting to gain the same privileges as a trusted system.::STEP:3:PHASE:Exploit:DESCRIPTION:[Impersonate] An adversary can use successful experiments or authentications to impersonate an authorized user or system or to laterally move within a system or application::STEP:4:PHASE:Exploit:DESCRIPTION:[Spoofing] Malicious data can be injected into the target system or into a victim user's system by an adversary. The adversary can also pose as a legitimate user to perform social engineering attacks.::STEP:5:PHASE:Exploit:DESCRIPTION:[Data Exfiltration] The adversary can obtain sensitive data contained within the system or application.::",::Server software must rely on weak identifier proof and/or verification schemes.::Identifiers must have long lifetimes and potential for reusability.::Server software must allow concurrent sessions to exist.::,"::SKILL:To achieve a direct connection with the weak or non-existent server session access control, and pose as an authorized user:LEVEL:Low::",::Ability to deploy software on network.::Ability to communicate synchronously or asynchronously with server.::,,::SCOPE:Confidentiality:SCOPE:Access Control:SCOPE:Authentication:TECHNICAL IMPACT:Gain Privileges::SCOPE:Confidentiality:TECHNICAL IMPACT:Read Data::SCOPE:Integrity:TECHNICAL IMPACT:Modify Data::,"::Design: utilize strong federated identity such as SAML to encrypt and sign identity tokens in transit.::Implementation: Use industry standards session key generation mechanisms that utilize high amount of entropy to generate the session key. Many standard web and application servers will perform this task on your behalf.::Implementation: If the identifier is used for authentication, such as in the so-called single sign on use cases, then ensure that it is protected at the same level of assurance as authentication tokens.::Implementation: If the web or application server supports it, then encrypting and/or signing the identifier (such as cookie) can protect the ID if intercepted.::Design: Use strong session identifiers that are protected in transit and at rest.::Implementation: Utilize a session timeout for all sessions, for example 20 minutes. If the user does not explicitly logout, the server terminates their session after this period of inactivity. If the user logs back in then a new session key is generated.::Implementation: Verify authenticity of all identifiers at runtime.::","::Thin client applications like web applications are particularly vulnerable to session ID attacks. Since the server has very little control over the client, but still must track sessions, data, and objects on the server side, cookies and other mechanisms have been used to pass the key to the session data between the client and server. When these session keys are compromised it is trivial for an adversary to impersonate a user's session in effect, have the same capabilities as the authorized user. There are two main ways for an adversary to exploit session IDs. A brute force attack involves an adversary repeatedly attempting to query the system with a spoofed session header in the HTTP request. A web server that uses a short session ID can be easily spoofed by trying many possible combinations so the parameters session-ID= 1234 has few possible combinations, and an adversary can retry several hundred or thousand request with little to no issue on their side. The second method is interception, where a tool such as wireshark is used to sniff the wire and pull off any unprotected session identifiers. The adversary can then use these variables and access the application.::For example, in a message queuing system that allows service requesters to post messages to its queue through an open channel (such as anonymous FTP), authorization is done through checking group or role membership contained in the posted message. However, there is no proof that the message itself, the information in the message (such group or role membership), or the process that wrote the message to the queue is authentic and authorized to do so.::",::290::302::346::539::6::384::664::602::642::,TAXONOMY NAME:ATTACK:ENTRY ID:1134:ENTRY NAME:Access Token Manipulation::::TAXONOMY NAME:ATTACK:ENTRY ID:1528:ENTRY NAME:Steal Application Access Token::::TAXONOMY NAME:ATTACK:ENTRY ID:1539:ENTRY NAME:Steal Web Session Cookie::,
Functionality Misuse,Meta,Stable,"An adversary leverages a legitimate capability of an application in such a way as to achieve a negative technical impact. The system functionality is not altered or modified but used in a way that was not intended. This is often accomplished through the overuse of a specific functionality or by leveraging functionality with design flaws that enables the adversary to gain access to unauthorized, sensitive data.",,Medium,Medium,,,::The adversary has the capability to interact with the application directly.The target system does not adequately implement safeguards to prevent misuse of authorized actions/processes.::,"::SKILL:General computer knowledge about how applications are launched, how they interact with input/output, and how they are configured.:LEVEL:Low::",,,"::SCOPE:Confidentiality:TECHNICAL IMPACT:Gain Privileges:NOTE:A successful attack of this kind can compromise the confidentiality of an authorized user's credentials.::SCOPE:Confidentiality:SCOPE:Integrity:SCOPE:Availability:TECHNICAL IMPACT:Other:NOTE:Depending on the adversary's intended technical impact, a successful attack of this kind can compromise any or all elements of the security triad.::","::Perform comprehensive threat modeling, a process of identifying, evaluating, and mitigating potential threats to the application. This effort can help reveal potentially obscure application functionality that can be manipulated for malicious purposes.::When implementing security features, consider how they can be misused and compromised.::",,::1242::1246::1281::,,
Communication Channel Manipulation,Meta,Stable,"An adversary manipulates a setting or parameter on communications channel in order to compromise its security. This can result in information exposure, insertion/removal of information from the communications stream, and/or potentially system compromise.",,,,::NATURE:CanPrecede:CAPEC ID:94::,,"::The target application must leverage an open communications channel.::The channel on which the target communicates must be vulnerable to interception (e.g., adversary in the middle attack - CAPEC-94).::",,::A tool that is capable of viewing network traffic and generating custom inputs to be used in the attack.::,,"::SCOPE:Integrity:TECHNICAL IMPACT:Read Data:TECHNICAL IMPACT:Modify Data:TECHNICAL IMPACT:Other:NOTE:The adversary's injection of additional content into a communication channel negatively impacts the integrity of that channel.::SCOPE:Confidentiality:TECHNICAL IMPACT:Read Data:NOTE:A successful Communication Channel Manipulation attack can result in sensitive information exposure to the adversary, thereby compromising the communication channel's confidentiality.::",::Encrypt all sensitive communications using properly-configured cryptography.::Design the communication system such that it associates proper authentication/authorization with each channel/message.::,,::306::,,
Exploiting Trust in Client,Meta,Draft,"An attack of this type exploits vulnerabilities in client/server communication channel authentication and data integrity. It leverages the implicit trust a server places in the client, or more importantly, that which the server believes is the client. An attacker executes this type of attack by communicating directly with the server where the server believes it is communicating only with a valid client. There are numerous variations of this type of attack.",,High,High,,,"::Server software must rely on client side formatted and validated values, and not reinforce these checks on the server side.::",::SKILL:The attacker must have fairly detailed knowledge of the syntax and semantics of client/server communications protocols and grammars:LEVEL:Medium::,::Ability to communicate synchronously or asynchronously with server::,,::SCOPE:Confidentiality:SCOPE:Integrity:SCOPE:Availability:TECHNICAL IMPACT:Execute Unauthorized Commands:NOTE:Run Arbitrary Code::SCOPE:Confidentiality:SCOPE:Access Control:SCOPE:Authorization:TECHNICAL IMPACT:Gain Privileges::SCOPE:Confidentiality:TECHNICAL IMPACT:Read Data::,::Design: Ensure that client process and/or message is authenticated so that anonymous communications and/or messages are not accepted by the system.::Design: Do not rely on client validation or encoding for security purposes.::Design: Utilize digital signatures to increase authentication assurance.::Design: Utilize two factor authentication to increase authentication assurance.::Implementation: Perform input validation for all remote content.::,"::Web applications may use JavaScript to perform client side validation, request encoding/formatting, and other security functions, which provides some usability benefits and eliminates some client-server round-tripping. However, the web server cannot assume that the requests it receives have been subject to those validations, because an attacker can use an alternate method for crafting the HTTP Request and submit data that contains poisoned values designed to spoof a user and/or get the web server to disclose information.::Web 2.0 style applications may be particularly vulnerable because they in large part rely on existing infrastructure which provides scalability without the ability to govern the clients. Attackers identify vulnerabilities that either assume the client side is responsible for some security services (without the requisite ability to ensure enforcement of these checks) and/or the lack of a hardened, default deny server configuration that allows for an attacker probing for weaknesses in unexpected ways. Client side validation, request formatting and other services may be performed, but these are strictly usability enhancements not security enhancements.::Many web applications use client side scripting like JavaScript to enforce authentication, authorization, session state and other variables, but at the end of day they all make requests to the server. These client side checks may provide usability and performance gains, but they lack integrity in terms of the http request. It is possible for an attacker to post variables directly to the server without using any of the client script security checks and customize the patterns to impersonate other users or probe for more information.::Many message oriented middleware systems like MQ Series are rely on information that is passed along with the message request for making authorization decisions, for example what group or role the request should be passed. However, if the message server does not or cannot authenticate the authorization information in the request then the server's policy decisions about authorization are trivial to subvert because the client process can simply elevate privilege by passing in elevated group or role information which the message server accepts and acts on.::",::290::287::20::200::693::,,
Fingerprinting,Meta,Stable,"An adversary compares output from a target system to known indicators that uniquely identify specific details about the target. Most commonly, fingerprinting is done to determine operating system and application versions. Fingerprinting can be done passively as well as actively. Fingerprinting by itself is not usually detrimental to the target. However, the information gathered through fingerprinting often enables an adversary to discover existing weaknesses in the target.",,High,Very Low,,,::A means by which to interact with the target system directly.::,"::SKILL:Some fingerprinting activity requires very specific knowledge of how different operating systems respond to various TCP/IP requests. Application fingerprinting can be as easy as envoking the application with the correct command line argument, or mouse clicking in the appropriate place on the screen.:LEVEL:Medium::","::If on a network, the adversary needs a tool capable of viewing network communications at the packet level and with header information, like Mitmproxy, Wireshark, or Fiddler.::",,::SCOPE:Confidentiality:TECHNICAL IMPACT:Read Data::,"::While some information is shared by systems automatically based on standards and protocols, remove potentially sensitive information that is not necessary for the application's functionality as much as possible.::",,::200::,TAXONOMY NAME:WASC:ENTRY ID:45:ENTRY NAME:Fingerprinting::,
Sustained Client Engagement,Meta,Draft,"An adversary attempts to deny legitimate users access to a resource by continually engaging a specific resource in an attempt to keep the resource tied up as long as possible. The adversary's primary goal is not to crash or flood the target, which would alert defenders; rather it is to repeatedly perform actions or abuse algorithmic flaws such that a given resource is tied up and not available to a legitimate user. By carefully crafting a requests that keep the resource engaged through what is seemingly benign requests, legitimate users are limited or completely denied access to the resource.",,,,,,::This pattern of attack requires a temporal aspect to the servicing of a given request. Success can be achieved if the adversary can make requests that collectively take more time to complete than legitimate user requests within the same time frame.::,,"::To successfully execute this pattern of attack, a script or program is often required that is capable of continually engaging the target and maintaining sustained usage of a specific resource. Depending on the configuration of the target, it may or may not be necessary to involve a network or cluster of objects all capable of making parallel requests.::",,,"::Potential mitigations include requiring a unique login for each resource request, constraining local unprivileged access by disallowing simultaneous engagements of the resource, or limiting access to the resource to one access per IP address. In such scenarios, the adversary would have to increase engagements either by launching multiple sessions manually or programmatically to counter such defenses.::",,::400::,TAXONOMY NAME:ATTACK:ENTRY ID:1499:ENTRY NAME:Endpoint Denial of Service::::TAXONOMY NAME:WASC:ENTRY ID:10:ENTRY NAME:Denial of Service::,
Privilege Escalation,Meta,Draft,An adversary exploits a weakness enabling them to elevate their privilege and perform an action that they are not supposed to be authorized to perform.,,,,,,,,,,,,,::269::1264::1311::,TAXONOMY NAME:ATTACK:ENTRY ID:1548:ENTRY NAME:Abuse Elevation Control Mechanism::,
Resource Injection,Meta,Stable,An adversary exploits weaknesses in input validation by manipulating resource identifiers enabling the unintended modification or specification of a resource.,,High,High,,,"::The target application allows the user to both specify the identifier used to access a system resource. Through this permission, the user gains the capability to perform actions on that resource (e.g., overwrite the file)::",,,,::SCOPE:Confidentiality:TECHNICAL IMPACT:Read Data::SCOPE:Integrity:TECHNICAL IMPACT:Modify Data::,::Ensure all input content that is delivered to client is sanitized against an acceptable content specification.::Perform input validation for all content.::Enforce regular patching of software.::,,::99::,TAXONOMY NAME:OWASP Attacks:ENTRY NAME:Resource Injection::,
DEPRECATED: Code Injection,Meta,Deprecated,This attack pattern has been deprecated as it is a duplicate of the existing attack pattern CAPEC-242 : Code Injection. Please refer to this other CAPEC going forward.,,,,,,,,,,,,,,,
Code Injection,Meta,Stable,"An adversary exploits a weakness in input validation on the target to inject new code into that which is currently executing. This differs from code inclusion in that code inclusion involves the addition or replacement of a reference to a code file, which is subsequently loaded by the target and used as part of the code of some application.",,High,High,,,"::The target software does not validate user-controlled input such that the execution of a process may be altered by sending code in through legitimate data channels, using no other mechanism.::",,,,::SCOPE:Confidentiality:SCOPE:Integrity:SCOPE:Availability:TECHNICAL IMPACT:Other:NOTE:Code Injection attack patterns can result in a wide variety of consequences and negatively affect all three elements of the security triad.::,"::Utilize strict type, character, and encoding enforcement::Ensure all input content that is delivered to client is sanitized against an acceptable content specification.::Perform input validation for all content.::Enforce regular patching of software.::",,::94::,TAXONOMY NAME:OWASP Attacks:ENTRY NAME:Code Injection::,
Command Injection,Meta,Stable,"An adversary looking to execute a command of their choosing, injects new items into an existing command thus modifying interpretation away from what was intended. Commands in this context are often standalone strings that are interpreted by a downstream component and cause specific responses. This type of attack is possible when untrusted values are used to build these command strings. Weaknesses in input validation or command construction can enable the attack and lead to successful exploitation.",,Medium,High,,,"::The target application must accept input from the user and then use this input in the construction of commands to be executed. In virtually all cases, this is some form of string input that is concatenated to a constant string defined by the application to form the full command to be executed.::",,,,::SCOPE:Confidentiality:SCOPE:Integrity:SCOPE:Availability:TECHNICAL IMPACT:Execute Unauthorized Commands:NOTE:A successful command injection attack enables an adversary to alter the command being executed and achieve a variety of negative consequences depending on the makeup of the new command. This includes potential information disclosure or the corruption of application data.::,"::All user-controllable input should be validated and filtered for potentially unwanted characters. Using an allowlist for input is desired, but if use of a denylist approach is necessary, then focusing on command related terms and delimiters is necessary.::Input should be encoded prior to use in commands to make sure command related characters are not treated as part of the command. For example, quotation characters may need to be encoded so that the application does not treat the quotation as a delimiter.::Input should be parameterized, or restricted to data sections of a command, thus removing the chance that the input will be treated as part of the command itself.::",,::77::,TAXONOMY NAME:OWASP Attacks:ENTRY NAME:Command Injection::,
Forced Deadlock,Meta,Stable,"The adversary triggers and exploits a deadlock condition in the target software to cause a denial of service. A deadlock can occur when two or more competing actions are waiting for each other to finish, and thus neither ever does. Deadlock conditions can be difficult to detect.",,Low,High,,"::STEP:1:PHASE:Explore:DESCRIPTION:The adversary initiates an exploratory phase to get familiar with the system.::STEP:2:PHASE:Explore:DESCRIPTION:The adversary triggers a first action (such as holding a resource) and initiates a second action which will wait for the first one to finish.::STEP:3:PHASE:Explore:DESCRIPTION:If the target program has a deadlock condition, the program waits indefinitely resulting in a denial of service.::","::The target host has a deadlock condition. There are four conditions for a deadlock to occur, known as the Coffman conditions. [REF-101]::The target host exposes an API to the user.::",::SKILL:This type of attack may be sophisticated and require knowledge about the system's resources and APIs.:LEVEL:Medium::,,,::SCOPE:Availability:TECHNICAL IMPACT:Resource Consumption:NOTE:A successful forced deadlock attack compromises the availability of the system by exhausting its available resources.::,"::Use known algorithm to avoid deadlock condition (for instance non-blocking synchronization algorithms).::For competing actions, use well-known libraries which implement synchronization.::","::An example of a deadlock which may occur in database products is the following. Client applications using the database may require exclusive access to a table, and in order to gain exclusive access they ask for a lock. If one client application holds a lock on a table and attempts to obtain the lock on a second table that is already held by a second client application, this may lead to deadlock if the second application then attempts to obtain the lock that is held by the first application (Source: Wikipedia, http://en.wikipedia.org/wiki/Deadlock)::",::412::567::662::667::833::1322::,TAXONOMY NAME:ATTACK:ENTRY ID:1499.004:ENTRY NAME:Endpoint Denial of Service: Application or System Exploitation::,
DEPRECATED: Abuse of Transaction Data Structure,Meta,Deprecated,This attack pattern has been deprecated as it was deemed not to be a legitimate attack pattern.,,,,,,,,,,,,,,,
Leveraging Race Conditions,Meta,Stable,"The adversary targets a race condition occurring when multiple processes access and manipulate the same resource concurrently, and the outcome of the execution depends on the particular order in which the access takes place. The adversary can leverage a race condition by running the race, modifying the resource and modifying the normal execution flow. For instance, a race condition can occur while accessing a file: the adversary can trick the system by replacing the original file with their version and cause the system to read the malicious file.",,High,High,,"::STEP:1:PHASE:Explore:DESCRIPTION:The adversary explores to gauge what level of access they have.::STEP:2:PHASE:Experiment:DESCRIPTION:The adversary gains access to a resource on the target host. The adversary modifies the targeted resource. The resource's value is used to determine the next normal execution action.::STEP:3:PHASE:Exploit:DESCRIPTION:The resource is modified/checked concurrently by multiple processes. By using one of the processes, the adversary is able to modify the value just before it is consumed by a different process. A race condition occurs and is exploited by the adversary to abuse the target host.::",::A resource is accessed/modified concurrently by multiple processes such that a race condition exists.::The adversary has the ability to modify the resource.::,::SKILL:Being able to run the race requires basic knowledge of concurrent processing including synchonization techniques.:LEVEL:Medium::,,,::SCOPE:Confidentiality:SCOPE:Access Control:SCOPE:Authorization:TECHNICAL IMPACT:Gain Privileges::SCOPE:Integrity:TECHNICAL IMPACT:Modify Data::,"::Use safe libraries to access resources such as files.::Be aware that improper use of access function calls such as chown(), tempfile(), chmod(), etc. can cause a race condition.::Use synchronization to control the flow of execution.::Use static analysis tools to find race conditions.::Pay attention to concurrency problems related to the access of resources.::","::The Net Direct client for Linux before 6.0.5 in Nortel Application Switch 2424, VPN 3050 and 3070, and SSL VPN Module 1000 extracts and executes files with insecure permissions, which allows local users to exploit a race condition to replace a world-writable file in /tmp/NetClient and cause another user to execute arbitrary code when attempting to execute this client, as demonstrated by replacing /tmp/NetClient/client. See also: CVE-2007-1057::The following code illustrates a file that is accessed multiple times by name in a publicly accessible directory. A race condition exists between the accesses where an attacker can replace the file referenced by the name (see [REF-107]). include <sys/types.h>include <fcntl.h>include <unistd.h> define FILE /tmp/myfiledefine UID 100 void test(char *str){int fd;fd = creat(FILE, 0644);if(fd == -1)return; chown(FILE, UID, -1); /* BAD */close(fd); } int main(int argc, char **argv){char *userstr;if(argc > 1) {userstr = argv[1];test(userstr); }return 0; }::",::368::363::366::370::362::662::689::667::665::1223::1254::1298::,,
