Name,Abstraction,Status,Description,Alternate Terms,Likelihood Of Attack,Typical Severity,Related Attack Patterns,Execution Flow,Prerequisites,Skills Required,Resources Required,Indicators,Consequences,Mitigations,Example Instances,Related Weaknesses,Taxonomy Mappings,Notes
Brute Force,Meta,Draft,"In this attack, some asset (information, functionality, identity, etc.) is protected by a finite secret value. The attacker attempts to gain access to this asset by using trial-and-error to exhaustively explore all the possible secret values in the hope of finding the secret (or a value that is functionally equivalent) that will unlock the asset.",,,High,,"::STEP:1:PHASE:Explore:DESCRIPTION:[Determine secret testing procedure] Determine how a potential guess of the secret may be tested. This may be accomplished by comparing some manipulation of the secret to a known value, use of the secret to manipulate some known set of data and determining if the result displays specific characteristics (for example, turning cryptotext into plaintext), or by submitting the secret to some external authority and having the external authority respond as to whether the value was the correct secret. Ideally, the attacker will want to determine the correctness of their guess independently since involvement of an external authority is usually slower and can provide an indication to the defender that a brute-force attack is being attempted.:TECHNIQUE:Determine if there is a way to parallelize the attack. Most brute force attacks can take advantage of parallel techniques by dividing the search space among available resources, thus dividing the average time to success by the number of resources available. If there is a single choke point, such as a need to check answers with an external authority, the attackers' position is significantly degraded.::STEP:2:PHASE:Explore:DESCRIPTION:[Reduce search space] Find ways to reduce the secret space. The smaller the attacker can make the space they need to search for the secret value, the greater their chances for success. There are a great many ways in which the search space may be reduced.:TECHNIQUE:If possible, determine how the secret was selected. If the secret was determined algorithmically (such as by a random number generator) the algorithm may have patterns or dependencies that reduce the size of the secret space. If the secret was created by a human, behavioral factors may, if not completely reduce the space, make some types of secrets more likely than others. (For example, humans may use the same secrets in multiple places or use secrets that look or sound familiar for ease of recall.):TECHNIQUE:If the secret was chosen algorithmically, cryptanalysis can be applied to the algorithm to discover patterns in this algorithm. (This is true even if the secret is not used in cryptography.) Periodicity, the need for seed values, or weaknesses in the generator all can result in a significantly smaller secret space.:TECHNIQUE:If the secret was chosen by a person, social engineering and simple espionage can indicate patterns in their secret selection. If old secrets can be learned (and a target may feel they have little need to protect a secret that has been replaced) hints as to their selection preferences can be gleaned. These can include character substitutions a target employs, patterns in sources (dates, famous phrases, music lyrics, family members, etc.). Once these patterns have been determined, the initial efforts of a brute-force attack can focus on these areas.:TECHNIQUE:Some algorithmic techniques for secret selection may leave indicators that can be tested for relatively easily and which could then be used to eliminate large areas of the search space for consideration. For example, it may be possible to determine that a secret does or does not start with a given character after a relatively small number of tests. Alternatively, it might be possible to discover the length of the secret relatively easily. These discoveries would significantly reduce the search space, thus increasing speed with which the attacker discovers the secret.::STEP:3:PHASE:Explore:DESCRIPTION:[Expand victory conditions] It is sometimes possible to expand victory conditions. For example, the attacker might not need to know the exact secret but simply needs a value that produces the same result using a one-way function. While doing this does not reduce the size of the search space, the presence of multiple victory conditions does reduce the likely amount of time that the attacker will need to explore the space before finding a workable value.::STEP:4:PHASE:Exploit:DESCRIPTION:[Gather information so attack can be performed independently.] If possible, gather the necessary information so a successful search can be determined without consultation of an external authority. This can be accomplished by capturing cryptotext (if the goal is decoding the text) or the encrypted password dictionary (if the goal is learning passwords).::","::The attacker must be able to determine when they have successfully guessed the secret. As such, one-time pads are immune to this type of attack since there is no way to determine when a guess is correct.::",::SKILL:The attack simply requires basic scripting ability to automate the exploration of the search space. More sophisticated attackers may be able to use more advanced methods to reduce the search space and increase the speed with which the secret is located.:LEVEL:Low::,"::None: No specialized resources are required to execute this type of attack. Ultimately, the speed with which an attacker discovers a secret is directly proportional to the computational resources the attacker has at their disposal. This attack method is resource expensive: having large amounts of computational power do not guarantee timely success, but having only minimal resources makes the problem intractable against all but the weakest secret selection procedures.::","::Repeated submissions of incorrect secret values may indicate a brute force attack. For example, repeated bad passwords when accessing user accounts or repeated queries to databases using non-existent keys.::Attempts to download files protected by secrets (usually using encryption) may be a precursor to an offline attack to break the file's encryption and read its contents. This is especially significant if the file itself contains other secret values, such as password files.::If the attacker is able to perform the checking offline then there will likely be no indication that an attack is ongoing.::",::SCOPE:Confidentiality:TECHNICAL IMPACT:Read Data::SCOPE:Confidentiality:SCOPE:Access Control:SCOPE:Authorization:TECHNICAL IMPACT:Gain Privileges::,"::Select a provably large secret space for selection of the secret. Provably large means that the procedure by which the secret is selected does not have artifacts that significantly reduce the size of the total secret space.::Use a secret space that is well known and with no known patterns that may reduce functional size.::Do not provide the means for an attacker to determine success independently. This forces the attacker to check their guesses against an external authority, which can slow the attack and warn the defender. This mitigation may not be possible if testing material must appear externally, such as with a transmitted cryptotext.::",,::330::326::521::,TAXONOMY NAME:ATTACK:ENTRY ID:1110:ENTRY NAME:Brute Force::::TAXONOMY NAME:WASC:ENTRY ID:11:ENTRY NAME:Brute Force::::TAXONOMY NAME:OWASP Attacks:ENTRY NAME:Brute force attack::,
Interface Manipulation,Meta,Draft,"An adversary manipulates the use or processing of an interface (e.g. Application Programming Interface (API) or System-on-Chip (SoC)) resulting in an adverse impact upon the security of the system implementing the interface. This can allow the adversary to bypass access control and/or execute functionality not intended by the interface implementation, possibly compromising the system which integrates the interface. Interface manipulation can take on a number of forms including forcing the unexpected use of an interface or the use of an interface in an unintended way.",,Medium,Medium,,,::The target system must expose interface functionality in a manner that can be discovered and manipulated by an adversary. This may require reverse engineering the interface or decrypting/de-obfuscating client-server exchanges.::,,"::The requirements vary depending upon the nature of the interface. For example, application-layer APIs related to the processing of the HTTP protocol may require one or more of the following: an Adversary-In-The-Middle (CAPEC-94) proxy, a web browser, or a programming/scripting language.::",,,,"::An adversary may make a request to an application that leverages a non-standard API that is known to incorrectly validate its data and thus it may be manipulated by supplying metacharacters or alternate encodings as input, resulting in any number of injection flaws, including SQL injection, cross-site scripting, or command execution.::API methods not intended for production, such as debugging or testing APIs, may not be disabled when deploying in a production environment. As a result, dangerous functionality can be exposed within the production environment, which an adversary can leverage to execute additional attacks.::SoC components contain insufficient identifiers, which allows an adversary to reset the device at will or read sensitive data from the device.::",::1192::,,
Authentication Abuse,Meta,Draft,"An attacker obtains unauthorized access to an application, service or device either through knowledge of the inherent weaknesses of an authentication mechanism, or by exploiting a flaw in the authentication scheme's implementation. In such an attack an authentication mechanism is functioning but a carefully controlled sequence of events causes the mechanism to grant access to the attacker.",,,Medium,,,"::An authentication mechanism or subsystem implementing some form of authentication such as passwords, digest authentication, security certificates, etc. which is flawed in some way.::",,"::A client application, command-line access to a binary, or scripting language capable of interacting with the authentication mechanism.::",,,,,::287::1244::,TAXONOMY NAME:ATTACK:ENTRY ID:1548:ENTRY NAME:Abuse Elevation Control Mechanism::,
Authentication Bypass,Meta,Draft,"An attacker gains access to application, service, or device with the privileges of an authorized or privileged user by evading or circumventing an authentication mechanism. The attacker is therefore able to access protected data without authentication ever having taken place.",,,Medium,,,"::An authentication mechanism or subsystem implementing some form of authentication such as passwords, digest authentication, security certificates, etc.::",,"::A client application, such as a web browser, or a scripting language capable of interacting with the target.::",,,,,::287::,TAXONOMY NAME:ATTACK:ENTRY ID:1548:ENTRY NAME:Abuse Elevation Control Mechanism::,
Excavation,Meta,Stable,An adversary actively probes the target in a manner that is designed to solicit information that could be leveraged for malicious purposes.,,High,Medium,::NATURE:CanPrecede:CAPEC ID:163::,,::An adversary requires some way of interacting with the system.::,,"::A tool, such as an Adversary in the Middle (CAPEC-94) Proxy or a fuzzer, that is capable of generating and injecting custom inputs to be used in the attack.::",,::SCOPE:Confidentiality:TECHNICAL IMPACT:Read Data::,::Minimize error/response output to only what is necessary for functional use or corrective language.::Remove potentially sensitive information that is not necessary for the application's functionality.::,,::200::1243::,,"TYPE:Other:NOTE:Large quantities of data is often moved from the target system to some other adversary controlled system. Data found on a target system might require extensive resources to be fully analyzed. Using these resources on the target system might enable a defender to detect the adversary. Additionally, proper analysis tools required might not be available on the target system.::::TYPE:Other:NOTE:This attack differs from Data Interception and other data collection attacks in that the attacker actively queries the target rather than simply watching for the target to reveal information.::"
Interception,Meta,Stable,"An adversary monitors data streams to or from the target for information gathering purposes. This attack may be undertaken to solely gather sensitive information or to support a further attack against the target. This attack pattern can involve sniffing network traffic as well as other types of data streams (e.g. radio). The adversary can attempt to initiate the establishment of a data stream or passively observe the communications as they unfold. In all variants of this attack, the adversary is not the intended recipient of the data stream. In contrast to other means of gathering information (e.g., targeting data leaks), the adversary must actively position themself so as to observe explicit data channels (e.g. network traffic) and read the content. However, this attack differs from a Adversary-In-the-Middle (CAPEC-94) attack, as the adversary does not alter the content of the communications nor forward data to the intended recipient.",,Low,Medium,,,::The target must transmit data over a medium that is accessible to the adversary.::,,"::The adversary must have the necessary technology to intercept information passing between the nodes of a network. For TCP/IP, the capability to run tcpdump, ethereal, etc. can be useful. Depending upon the data being targeted the technological requirements will change.::",,::SCOPE:Confidentiality:TECHNICAL IMPACT:Read Data::,::Leverage encryption to encode the transmission of data thus making it accessible only to authorized parties.::,,::319::,,
Privilege Abuse,Meta,Draft,An adversary is able to exploit features of the target that should be reserved for privileged users or administrators but are exposed to use by lower or non-privileged accounts. Access to sensitive information and functionality must be controlled to ensure that only authorized users are able to access these resources.,,High,Medium,::NATURE:CanPrecede:CAPEC ID:664::,,"::The target must have misconfigured their access control mechanisms such that sensitive information, which should only be accessible to more trusted users, remains accessible to less trusted users.::The adversary must have access to the target, albeit with an account that is less privileged than would be appropriate for the targeted resources.::",::SKILL:Adversary can leverage privileged features they already have access to without additional effort or skill. Adversary is only required to have access to an account with improper priveleges.:LEVEL:Low::,::None: No specialized resources are required to execute this type of attack. The ability to access the target is required.::,,::SCOPE:Integrity:TECHNICAL IMPACT:Modify Data::SCOPE:Confidentiality:TECHNICAL IMPACT:Read Data::SCOPE:Authorization:TECHNICAL IMPACT:Execute Unauthorized Commands:NOTE:Run Arbitrary Code::SCOPE:Authorization:TECHNICAL IMPACT:Gain Privileges::SCOPE:Access Control:SCOPE:Authorization:TECHNICAL IMPACT:Bypass Protection Mechanism::,::Configure account privileges such privileged/administrator functionality is not exposed to non-privileged/lower accounts.::,"::Improperly configured account privileges allowed unauthorized users on a hospital's network to access the medical records for over 3,000 patients. Thus compromising data integrity and confidentiality in addition to HIPAA violations.::",::269::732::1317::,TAXONOMY NAME:ATTACK:ENTRY ID:1548:ENTRY NAME:Abuse Elevation Control Mechanism::,
Buffer Manipulation,Meta,Draft,"An adversary manipulates an application's interaction with a buffer in an attempt to read or modify data they shouldn't have access to. Buffer attacks are distinguished in that it is the buffer space itself that is the target of the attack rather than any code responsible for interpreting the content of the buffer. In virtually all buffer attacks the content that is placed in the buffer is immaterial. Instead, most buffer attacks involve retrieving or providing more input than can be stored in the allocated buffer, resulting in the reading or overwriting of other unintended program memory.",,High,Very High,,,"::The adversary must identify a programmatic means for interacting with a buffer, such as vulnerable C code, and be able to provide input to this interaction.::",,,,"::SCOPE:Availability:TECHNICAL IMPACT:Unreliable Execution:NOTE:A buffer manipulation attack often results in a crash of the application due to the corruption of memory.::SCOPE:Confidentiality:TECHNICAL IMPACT:Execute Unauthorized Commands:TECHNICAL IMPACT:Modify Data:TECHNICAL IMPACT:Read Data:NOTE:If constructed properly, a buffer manipulation attack can be used to contol the execution of the application leading to any number of negative consequenses.::","::To help protect an application from buffer manipulation attacks, a number of potential mitigations can be leveraged. Before starting the development of the application, consider using a code language (e.g., Java) or compiler that limits the ability of developers to act beyond the bounds of a buffer. If the chosen language is susceptible to buffer related issues (e.g., C) then consider using secure functions instead of those vulnerable to buffer manipulations. If a potentially dangerous function must be used, make sure that proper boundary checking is performed. Additionally, there are often a number of compiler-based mechanisms (e.g., StackGuard, ProPolice and the Microsoft Visual Studio /GS flag) that can help identify and protect against potential buffer issues. Finally, there may be operating system level preventative functionality that can be applied.::",,::119::,,
Shared Resource Manipulation,Meta,Draft,"An adversary exploits a resource shared between multiple applications, an application pool or hardware pin multiplexing to affect behavior. Resources may be shared between multiple applications or between multiple threads of a single application. Resource sharing is usually accomplished through mutual access to a single memory location or multiplexed hardware pins. If an adversary can manipulate this shared resource (usually by co-opting one of the applications or threads) the other applications or threads using the shared resource will often continue to trust the validity of the compromised shared resource and use it in their calculations. This can result in invalid trust assumptions, corruption of additional data through the normal operations of the other users of the shared resource, or even cause a crash or compromise of the sharing applications.",,,Medium,,,"::The target applications, threads or functions must share resources between themselves.::The adversary must be able to manipulate some piece of the shared resource either directly or indirectly and the other users of the data must accept the changed data as valid. Usually this requires that the adversary be able to compromise one of the sharing applications or threads in order to manipulate the shared data.::",,::None: The attacker does not need any specialized resources to execute this type of attack.::,,,,,::1189::1331::,,
Flooding,Meta,Stable,"An adversary consumes the resources of a target by rapidly engaging in a large number of interactions with the target. This type of attack generally exposes a weakness in rate limiting or flow. When successful this attack prevents legitimate users from accessing the service and can cause the target to crash. This attack differs from resource depletion through leaks or allocations in that the latter attacks do not rely on the volume of requests made to the target but instead focus on manipulation of the target's operations. The key factor in a flooding attack is the number of requests the adversary can make in a given period of time. The greater this number, the more likely an attack is to succeed against a given target.",,High,Medium,,,::Any target that services requests is vulnerable to this attack on some level of scale.::,,"::A script or program capable of generating more requests than the target can handle, or a network or cluster of objects all capable of making simultaneous requests.::",,::SCOPE:Availability:TECHNICAL IMPACT:Unreliable Execution:TECHNICAL IMPACT:Resource Consumption:NOTE:A successful flooding attack compromises the availability of the target system's service by exhausting its available resources.::,::Ensure that protocols have specific limits of scale configured.::Specify expectations for capabilities and dictate which behaviors are acceptable when resource allocation reaches limits.::Uniformly throttle all requests in order to make it more difficult to consume resources more quickly than they can again be freed.::,,::404::770::,TAXONOMY NAME:ATTACK:ENTRY ID:1498.001:ENTRY NAME:Network Denial of Service: Direct Network Flood::::TAXONOMY NAME:ATTACK:ENTRY ID:1499:ENTRY NAME:Endpoint Denial of Service::::TAXONOMY NAME:WASC:ENTRY ID:10:ENTRY NAME:Denial of Service::::TAXONOMY NAME:OWASP Attacks:ENTRY NAME:Traffic flood::,
Pointer Manipulation,Meta,Draft,"This attack pattern involves an adversary manipulating a pointer within a target application resulting in the application accessing an unintended memory location. This can result in the crashing of the application or, for certain pointer values, access to data that would not normally be possible or the execution of arbitrary code. Since pointers are simply integer variables, Integer Attacks may often be used in Pointer Attacks.",,,Medium,,,::The target application must have a pointer variable that the attacker can influence to hold an arbitrary value.::,,::None: No specialized resources are required to execute this type of attack.::,,,,,::682::822::823::,,
Excessive Allocation,Meta,Stable,"An adversary causes the target to allocate excessive resources to servicing the attackers' request, thereby reducing the resources available for legitimate services and degrading or denying services. Usually, this attack focuses on memory allocation, but any finite resource on the target could be the attacked, including bandwidth, processing cycles, or other resources. This attack does not attempt to force this allocation through a large number of requests (that would be Resource Depletion through Flooding) but instead uses one or a small number of requests that are carefully formatted to force the target to allocate excessive resources to service this request(s). Often this attack takes advantage of a bug in the target to cause the target to allocate resources vastly beyond what would be needed for a normal request.",,Medium,Medium,,,::The target must accept service requests from the attacker and the adversary must be able to control the resource allocation associated with this request to be in excess of the normal allocation. The latter is usually accomplished through the presence of a bug on the target that allows the adversary to manipulate variables used in the allocation.::,,::None: No specialized resources are required to execute this type of attack.::,,"::SCOPE:Availability:TECHNICAL IMPACT:Resource Consumption:NOTE:A successful excessive allocation attack forces the target system to exhaust its resources, thereby compromising the availability of its service.::","::Limit the amount of resources that are accessible to unprivileged users.::Assume all input is malicious. Consider all potentially relevant properties when validating input.::Consider uniformly throttling all requests in order to make it more difficult to consume resources more quickly than they can again be freed.::Use resource-limiting settings, if possible.::","::In an Integer Attack, the adversary could cause a variable that controls allocation for a request to hold an excessively large value. Excessive allocation of resources can render a service degraded or unavailable to legitimate users and can even lead to crashing of the target.::",::404::770::1325::,TAXONOMY NAME:ATTACK:ENTRY ID:1499.003:ENTRY NAME:Endpoint Denial of Service:Application Exhaustion Flood::::TAXONOMY NAME:WASC:ENTRY ID:10:ENTRY NAME:Denial of Service::,
Resource Leak Exposure,Meta,Stable,An adversary utilizes a resource leak on the target to deplete the quantity of the resource available to service legitimate requests.,,Medium,Medium,,,::The target must have a resource leak that the adversary can repeatedly trigger.::,,::None: No specialized resources are required to execute this type of attack.::,,::SCOPE:Availability:TECHNICAL IMPACT:Unreliable Execution:TECHNICAL IMPACT:Resource Consumption:NOTE:A successful resource leak exposure attack compromises the availability of the target system's services.::,"::If possible, leverage coding language(s) that do not allow this weakness to occur (e.g., Java, Ruby, and Python all perform automatic garbage collection that releases memory for objects that have been deallocated).::Memory should always be allocated/freed using matching functions (e.g., malloc/free, new/delete, etc.)::Implement best practices with respect to memory management, including the freeing of all allocated resources at all exit points and ensuring consistency with how and where memory is freed in a function.::",,::404::,TAXONOMY NAME:ATTACK:ENTRY ID:1499:ENTRY NAME:Endpoint Denial of Service::::TAXONOMY NAME:WASC:ENTRY ID:10:ENTRY NAME:Denial of Service::,
