Name,Abstraction,Status,Description,Alternate Terms,Likelihood Of Attack,Typical Severity,Related Attack Patterns,Execution Flow,Prerequisites,Skills Required,Resources Required,Indicators,Consequences,Mitigations,Example Instances,Related Weaknesses,Taxonomy Mappings,Notes
DEPRECATED: Environment Variable Manipulation,Meta,Deprecated,This attack pattern has been deprecated as it is a duplicate of the existing attack pattern CAPEC-13 : Subverting Environment Variable Values. Please refer to this other CAPEC going forward.,,,,,,,,,,,,,,,
DEPRECATED: Global variable manipulation,Meta,Deprecated,This attack pattern has been deprecated as it is a duplicate of the existing attack pattern CAPEC-77 : Manipulating User-Controlled Variables. Please refer to this other CAPEC going forward.,,,,,,,,,,,,,,,
DEPRECATED: Manipulate Canonicalization,Meta,Deprecated,This attack pattern has been deprecated.,,,,,,,,,,,,,,,
DEPRECATED: Registry Manipulation,Meta,Deprecated,This pattern has been deprecated as it was determined to be a duplicate of another pattern. Please refer to the pattern CAPEC-203 : Manipulate Application Registry Values going forward.,,,,,,,,,,,,,,,
Protocol Manipulation,Meta,Draft,"An adversary subverts a communications protocol to perform an attack. This type of attack can allow an adversary to impersonate others, discover sensitive information, control the outcome of a session, or perform other attacks. This type of attack targets invalid assumptions that may be inherent in implementers of the protocol, incorrect implementations of the protocol, or vulnerabilities in the protocol itself.",,,Medium,,,::The protocol or implementations thereof must contain bugs that an adversary can exploit.::,,::In some variants of this attack the adversary must be able to intercept communications using the protocol. This means they need to be able to receive the communications from one participant and prevent the other participant from receiving these communications.::,,,,,,,
Fuzzing,Meta,Draft,"In this attack pattern, the adversary leverages fuzzing to try to identify weaknesses in the system. Fuzzing is a software security and functionality testing method that feeds randomly constructed input to the system and looks for an indication that a failure in response to that input has occurred. Fuzzing treats the system as a black box and is totally free from any preconceptions or assumptions about the system. Fuzzing can help an attacker discover certain assumptions made about user input in the system. Fuzzing gives an attacker a quick way of potentially uncovering some of these assumptions despite not necessarily knowing anything about the internals of the system. These assumptions can then be turned against the system by specially crafting user input that may allow an attacker to achieve their goals.",,High,Medium,,"::STEP:1:PHASE:Explore:DESCRIPTION:[Observe communication and inputs] The fuzzing attacker observes the target system looking for inputs and communications between modules, subsystems, or systems.:TECHNIQUE:Network sniffing. Using a network sniffer such as wireshark, the attacker observes communications into and out of the target system.:TECHNIQUE:Monitor API execution. Using a tool such as ktrace, strace, APISpy, or another debugging tool, the attacker observes the system calls and API calls that are made by the target system, and the nature of their parameters.:TECHNIQUE:Observe inputs using web inspection tools (OWASP's WebScarab, Paros, TamperData, TamperIE, etc.)::STEP:2:PHASE:Experiment:DESCRIPTION:[Generate fuzzed inputs] Given a fuzzing tool, a target input or protocol, and limits on time, complexity, and input variety, generate a list of inputs to try. Although fuzzing is random, it is not exhaustive. Parameters like length, composition, and how many variations to try are important to get the most cost-effective impact from the fuzzer.:TECHNIQUE:Boundary cases. Generate fuzz inputs that attack boundary cases of protocol fields, inputs, or other communications limits. Examples include 0xff and 0x00 for single-byte inputs. In binary situations, approach each bit of an individual field with on and off (e.g., 0x80).:TECHNIQUE:Attempt arguments to system calls or APIs. The variations include payloads that, if they were successful, could lead to a compromise on the system.::STEP:3:PHASE:Experiment:DESCRIPTION:[Observe the outcome] Observe the outputs to the inputs fed into the system by fuzzers and see if anything interesting happens. If failure occurs, determine why that happened. Figure out the underlying assumption that was invalidated by the input.::STEP:4:PHASE:Exploit:DESCRIPTION:[Craft exploit payloads] Put specially crafted input into the system that leverages the weakness identified through fuzzing and allows to achieve the goals of the attacker. Fuzzers often reveal ways to slip through the input validation filters and introduce unwanted data into the system.:TECHNIQUE:Identify and embed shell code for the target system.:TECHNIQUE:Embed higher level attack commands in the payload. (e.g., SQL, PHP, server-side includes, etc.):TECHNIQUE:Induce denial of service by exploiting resource leaks or bad error handling.::",,::SKILL:There is a wide variety of fuzzing tools available.:LEVEL:Low::,::Fuzzing tools.::,::A lot of invalid data is fed to the system. Data that cannot have been generated through a legitimate transaction/request. Data is coming into the system within a short period of time and potentially from the same IP.::,::SCOPE:Integrity:TECHNICAL IMPACT:Modify Data::SCOPE:Availability:TECHNICAL IMPACT:Unreliable Execution::SCOPE:Confidentiality:TECHNICAL IMPACT:Read Data::SCOPE:Confidentiality:SCOPE:Access Control:SCOPE:Authorization:TECHNICAL IMPACT:Gain Privileges::SCOPE:Confidentiality:SCOPE:Integrity:SCOPE:Availability:TECHNICAL IMPACT:Alter Execution Logic::,"::Test to ensure that the software behaves as per specification and that there are no unintended side effects. Ensure that no assumptions about the validity of data are made.::Use fuzz testing during the software QA process to uncover any surprises, uncover any assumptions or unexpected behavior.::","::A fuzz test reveals that when data length for a particular field exceeds certain length, the input validation filter fails and lets the user data in unfiltered. This provides an attacker with an injection vector to deliver the malicious payload into the system.::",::74::20::,,
DEPRECATED: ICMP Echo Request Ping,Meta,Deprecated,This attack pattern has been deprecated as it is a duplicate of the existing attack pattern CAPEC-285. Please refer to this other CAPEC going forward.,,,Low,,,,,,,,,,,,
DEPRECATED: Infrastructure-based footprinting,Meta,Deprecated,"This attack pattern has been deprecated as it was determined to be an unnecessary layer of abstraction. Please refer to the meta level pattern CAPEC-169 : going forward, or to any of its children patterns.",,,,,,,,,,,,,,,
Bypassing Physical Security,Meta,Draft,"Facilities often used layered models for physical security such as traditional locks, Electronic-based card entry systems, coupled with physical alarms. Hardware security mechanisms range from the use of computer case and cable locks as well as RFID tags for tracking computer assets. This layered approach makes it difficult for random physical security breaches to go unnoticed, but is less effective at stopping deliberate and carefully planned break-ins. Avoiding detection begins with evading building security and surveillance and methods for bypassing the electronic or physical locks which secure entry points.",,,,,,,,,,,,,,,
DEPRECATED: Social Information Gathering Attacks,Meta,Deprecated,This attack pattern has been deprecated as it was deemed not to be a legitimate attack pattern. Please refer to CAPEC-118 : Collect and Analyze Information.,,,,,,,,,,,,,,,
DEPRECATED: Social Information Gathering via Research,Meta,Deprecated,This attack pattern has been deprecated as it was deemed not to be a legitimate attack pattern. Please refer to CAPEC-118 : Collect and Analyze Information.,,,,,,,,,,,,,,,
DEPRECATED: Information Gathering from Traditional Sources,Meta,Deprecated,This attack pattern has been deprecated as it was deemed not to be a legitimate attack pattern. Please refer to CAPEC-118 : Collect and Analyze Information.,,,,,,,,,,,,,,,
DEPRECATED: Information Gathering from Non-Traditional Sources,Meta,Deprecated,This attack pattern has been deprecated as it was deemed not to be a legitimate attack pattern. Please refer to CAPEC-118 : Collect and Analyze Information.,,,,,,,,,,,,,,,
Information Elicitation,Meta,Draft,"An adversary engages an individual using any combination of social engineering methods for the purpose of extracting information. Accurate contextual and environmental queues, such as knowing important information about the target company or individual can greatly increase the success of the attack and the quality of information gathered. Authentic mimicry combined with detailed knowledge increases the success of elicitation attacks.",,,Low,,,,,,,,,,,,
DEPRECATED: Pretexting,Meta,Deprecated,This attack pattern has been deprecated as it is a duplicate of the existing attack pattern CAPEC-407 : Social Information Gathering via Pretexting. Please refer to this other CAPEC going forward.,,,,,,,,,,,,,,,
Manipulate Human Behavior,Meta,Stable,"An adversary exploits inherent human psychological predisposition to influence a targeted individual or group to solicit information or manipulate the target into performing an action that serves the adversary's interests. Many interpersonal social engineering techniques do not involve outright deception, although they can; many are subtle ways of manipulating a target to remove barriers, make the target feel comfortable, and produce an exchange in which the target is either more likely to share information directly, or let key information slip out unintentionally. A skilled adversary uses these techniques when appropriate to produce the desired outcome. Manipulation techniques vary from the overt, such as pretending to be a supervisor to a help desk, to the subtle, such as making the target feel comfortable with the adversary's speech and thought patterns.",,Medium,Medium,,,::The adversary must have the means and knowledge of how to communicate with the target in some manner.::,,,,"::SCOPE:Confidentiality:SCOPE:Integrity:SCOPE:Availability:TECHNICAL IMPACT:Other:NOTE:Attack patterns that manipulate human behavior can result in a wide variety of consequences and potentially affect the confidentiality, availability, and/or integrity of an application or system.::","::An organization should provide regular, robust cybersecurity training to its employees to prevent successful social engineering attacks.::",,,,
DEPRECATED: Target Influence via Perception of Concession,Meta,Deprecated,This attack pattern has been deprecated as it was deemed not to be a legitimate pattern.,,,,,,,,,,,,,,,
Modification During Manufacture,Meta,Draft,"An attacker modifies a technology, product, or component during a stage in its manufacture for the purpose of carrying out an attack against some entity involved in the supply chain lifecycle. There are an almost limitless number of ways an attacker can modify a technology when they are involved in its manufacture, as the attacker has potential inroads to the software composition, hardware design and assembly, firmware, or basic design mechanics. Additionally, manufacturing of key components is often outsourced with the final product assembled by the primary manufacturer. The greatest risk, however, is deliberate manipulation of design specifications to produce malicious hardware or devices. There are billions of transistors in a single integrated circuit and studies have shown that fewer than 10 transistors are required to create malicious functionality.",,,,,,,,,,,,,,TAXONOMY NAME:ATTACK:ENTRY ID:1195:ENTRY NAME:Supply Chain Compromise::,
Manipulation During Distribution,Meta,Draft,"An attacker undermines the integrity of a product, software, or technology at some stage of the distribution channel. The core threat of modification or manipulation during distribution arise from the many stages of distribution, as a product may traverse multiple suppliers and integrators as the final asset is delivered. Components and services provided from a manufacturer to a supplier may be tampered with during integration or packaging.",,,,,,,,,,,,"::A malicious OEM provider, or OEM provider employee or contractor, may install software, or modify existing code, during distribution.::External contractors involved in the packaging or testing of products or components may install software, or modify existing code, during distribution.::",::1269::,TAXONOMY NAME:ATTACK:ENTRY ID:1195:ENTRY NAME:Supply Chain Compromise::,
Hardware Integrity Attack,Meta,Stable,"An adversary exploits a weakness in the system maintenance process and causes a change to be made to a technology, product, component, or sub-component or a new one installed during its deployed use at the victim location for the purpose of carrying out an attack.",,Low,High,,,::Influence over the deployed system at a victim location.::,,,,::SCOPE:Integrity:TECHNICAL IMPACT:Execute Unauthorized Commands::,,,,TAXONOMY NAME:ATTACK:ENTRY ID:1195.003:ENTRY NAME:Supply Chain Compromise: Compromise Hardware Supply Chain::::TAXONOMY NAME:ATTACK:ENTRY ID:1200:ENTRY NAME:Hardware Additions::,
Malicious Logic Insertion,Meta,Stable,"An adversary installs or adds malicious logic (also known as malware) into a seemingly benign component of a fielded system. This logic is often hidden from the user of the system and works behind the scenes to achieve negative impacts. With the proliferation of mass digital storage and inexpensive multimedia devices, Bluetooth and 802.11 support, new attack vectors for spreading malware are emerging for things we once thought of as innocuous greeting cards, picture frames, or digital projectors. This pattern of attack focuses on systems already fielded and used in operation as opposed to systems and their components that are still under development and part of the supply chain.",,Medium,High,,,::Access to the component currently deployed at a victim location.::,,,,::SCOPE:Authorization:TECHNICAL IMPACT:Execute Unauthorized Commands::,,,::284::,,
Physical Theft,Meta,Draft,An adversary gains physical access to a system or device through theft of the item. Possession of a system or device enables a number of unique attacks to be executed and often provides the adversary with an extended timeframe for which to perform an attack. Most protections put in place to secure sensitive information can be defeated when an adversary has physical access and enough time.,,,,,,::This type of attack requires the existence of a physical target that an adversary believes hosts something of value.::,,,,,"::To mitigate this type of attack, physical security techniques such as locks doors, alarms, and monitoring of targets should be implemented.::",,,,
Contaminate Resource,Meta,Draft,"An adversary contaminates organizational information systems (including devices and networks) by causing them to handle information of a classification/sensitivity for which they have not been authorized. When this happens, the contaminated information system, device, or network must be brought offline to investigate and mitigate the data spill, which denies availability of the system until the investigation is complete.",::TERM:Data Spill:DESCRIPTION:When information is handled by an information system of a classification/sensitivity for which the system has not been authorized to handle.::,Low,High,::NATURE:CanPrecede:CAPEC ID:607::,,::The adversary needs to have real or fake classified/sensitive information to place on a system::,::SKILL:Knowledge of classification levels of systems:LEVEL:Low::SKILL:The ability to obtain a classified document or information:LEVEL:High::SKILL:The ability to fake a classified document:LEVEL:Low::,,,::SCOPE:Availability:TECHNICAL IMPACT:Resource Consumption:NOTE:Denial of Service::SCOPE:Confidentiality:TECHNICAL IMPACT:Read Data:NOTE:Victims of the attack can be exposed to classified materials::,"::Properly safeguard classified/sensitive data. This includes training cleared individuals to ensure they are handling and disposing of this data properly, as well as ensuring systems only handle information of the classification level they are designed for.::Design systems with redundancy in mind. This could mean creating backing servers that could be switched over to in the event that a server has to be taken down for investigation.::Have a planned and efficient response plan to limit the amount of time a system is offline while the contamination is investigated.::","::An insider threat was able to obtain a classified document. They have knowledge that a backend server which provides access to a website also runs a mail server. The adversary creates a throwaway email address and sends the classified document to the mail server. When an administrator checks the mail server they notice that it has processed an email with a classified document and the server has to be taken offline while they investigate the contamination. In the meantime, the website has to be taken down as well and access to the website is denied until the backend can be migrated to another server or the investigation is complete.::",,,
Local Execution of Code,Meta,Stable,"An adversary installs and executes malicious code on the target system in an effort to achieve a negative technical impact. Examples include rootkits, ransomware, spyware, adware, and others.",,Medium,High,,,::Knowledge of the target system's vulnerabilities that can be capitalized on with malicious code.The adversary must be able to place the malicious code on the target system.::,,"::The means by which the adversary intends to place the malicious code on the system dictates the tools required. For example, suppose the adversary wishes to leverage social engineering and convince a legitimate user to open a malicious file attached to a seemingly legitimate email. In this case, the adversary might require a tool capable of wrapping malicious code into an innocuous filetype (e.g., PDF, .doc, etc.)::",,"::SCOPE:Confidentiality:SCOPE:Integrity:SCOPE:Availability:TECHNICAL IMPACT:Execute Unauthorized Commands:NOTE:Run Arbitrary Code::SCOPE:Confidentiality:SCOPE:Integrity:SCOPE:Availability:TECHNICAL IMPACT:Other:NOTE:Depending on the type of code executed by the adversary, the consequences of this attack pattern can vary widely.::",::Employ robust cybersecurity training for all employees.::Implement system antivirus software that scans all attachments before opening them.::Regularly patch all software.::Execute all suspicious files in a sandbox environment.::,"::BlueBorne refers to a set of nine vulnerabilities on different platforms (Linux, Windows, Android, iOS) that offer an adversary the ability to install and execute malicious code on a system if they were close in proximity to a Bluetooth enabled device. One vulnerability affecting iOS versions 7 through 9 allowed an attacker to overflow the Low Energy Audio Protocol since commands sent over this protocol are improperly validated and gain the elevated permissions of the Bluetooth stack. These vulnerabilities were a result of poor validation and were patched shortly after their exposure in 2017, but many non-updated devices remain vulnerable.::",::829::,,
Functionality Bypass,Meta,Draft,"An adversary attacks a system by bypassing some or all functionality intended to protect it. Often, a system user will think that protection is in place, but the functionality behind those protections has been disabled by the adversary.",,Medium,High,,,,,,,,,,::424::1299::,,
Use of Known Domain Credentials,Meta,Stable,An adversary guesses or obtains (i.e. steals or purchases) legitimate credentials (e.g. userID/password) to achieve authentication and to perform authorized actions under the guise of an authenticated user or service.,,High,High,::NATURE:CanPrecede:CAPEC ID:151::,"::STEP:1:PHASE:Explore:DESCRIPTION:[Acquire known credentials] The adversary must obtain known credentials in order to access the target system, application, or service.:TECHNIQUE:An adversary purchases breached username/password combinations or leaked hashed passwords from the dark web.:TECHNIQUE:An adversary leverages a key logger or phishing attack to steal user credentials as they are provided.:TECHNIQUE:An adversary conducts a sniffing attack to steal credentials as they are transmitted.:TECHNIQUE:An adversary gains access to a database and exfiltrates password hashes.:TECHNIQUE:An adversary examines outward-facing configuration and properties files to discover hardcoded credentials.::STEP:2:PHASE:Explore:DESCRIPTION:[Determine target's password policy] Determine the password policies of the target system/application to determine if the known credentials fit within the specified criteria.:TECHNIQUE:Determine minimum and maximum allowed password lengths.:TECHNIQUE:Determine format of allowed passwords (whether they are required or allowed to contain numbers, special characters, etc., or whether they are allowed to contain words from the dictionary).:TECHNIQUE:Determine account lockout policy (a strict account lockout policy will prevent brute force attacks if multiple passwords are known for a single user account).::STEP:3:PHASE:Experiment:DESCRIPTION:[Attempt authentication] Try each credential until the target grants access.:TECHNIQUE:Manually or automatically enter each credential through the target's interface.::STEP:4:PHASE:Exploit:DESCRIPTION:[Impersonate] An adversary can use successful experiments or authentications to impersonate an authorized user or system, or to laterally move within a system or application::STEP:5:PHASE:Exploit:DESCRIPTION:[Spoofing] Malicious data can be injected into the target system or into a victim user's system by an adversary. The adversary can also pose as a legitimate user to perform social engineering attacks.::STEP:6:PHASE:Exploit:DESCRIPTION:[Data Exfiltration] The adversary can obtain sensitive data contained within the system or application.::","::The system/application uses one factor password based authentication, SSO, and/or cloud-based authentication.::The system/application does not have a sound password policy that is being enforced.::The system/application does not implement an effective password throttling mechanism.::The adversary possesses a list of known user accounts and corresponding passwords that may exist on the target.::","::SKILL:Once an adversary obtains a known credential, leveraging it is trivial.:LEVEL:Low::",::A list of known credentials.::A custom script that leverages the credential list to launch an attack.::,::Authentication attempts use credentials that have been used previously by the account in question.::Authentication attempts are originating from IP addresses or locations that are inconsistent with the user's normal IP addresses or locations.::Data is being transferred and/or removed from systems/applications within the network.::Suspicious or Malicious software is downloaded/installed on systems within the domain.::Messages from a legitimate user appear to contain suspicious links or communications not consistent with the user's normal behavior.::,::SCOPE:Confidentiality:SCOPE:Access Control:SCOPE:Authentication:TECHNICAL IMPACT:Gain Privileges::SCOPE:Confidentiality:SCOPE:Authorization:TECHNICAL IMPACT:Read Data::SCOPE:Integrity:TECHNICAL IMPACT:Modify Data::,"::Leverage multi-factor authentication for all authentication services and prior to granting an entity access to the domain network.::Create a strong password policy and ensure that your system enforces this policy.::Ensure users are not reusing username/password combinations for multiple systems, applications, or services.::Do not reuse local administrator account credentials across systems.::Deny remote use of local admin credentials to log into domain systems.::Do not allow accounts to be a local administrator on more than one system.::Implement an intelligent password throttling mechanism. Care must be taken to assure that these mechanisms do not excessively enable account lockout attacks such as CAPEC-2.::Monitor system and domain logs for abnormal credential access.::","::Throughout 2015 and 2016, APT28  also known as Pawn Storm, Sednit, Fancy Bear, Sofacy, and STRONTIUM  leveraged stolen credentials to infiltrate the Democratic National Committee (DNC), the United States Army, the World Anti-Doping Agency (WADA), the Court of Arbitration for Sport (TAS-CAS), and more. In most cases, the legitimate credentials were obtained via calculated spearphishing, tabnabbing, and DNS attacks targeted at corporate webmail systems. APT28 also executed several watering hole attacks, in addition to exploiting several zero-day vulnerabilities within Flash and Windows. The stolen credentials were then utilized to maintain authenticated access, laterally move within the local network, and exfiltrate sensitive information including DNC emails and personal medical records of numerous athletes. [REF-571]::In early 2019, FIN6 exploited stolen credentials from an organization within the engineering industry to laterally move within an environment via the Windows Remote Desktop Protocol (RDP). Multiple servers were subsequently infected with malware to create malware distribution servers, which were used to distribute the LockerGoga ransomware. [REF-573]::",::522::307::308::309::262::263::654::1273::,TAXONOMY NAME:ATTACK:ENTRY ID:1078:ENTRY NAME:Valid Accounts::,
