Name,Abstraction,Status,Description,Alternate Terms,Likelihood Of Attack,Typical Severity,Related Attack Patterns,Execution Flow,Prerequisites,Skills Required,Resources Required,Indicators,Consequences,Mitigations,Example Instances,Related Weaknesses,Taxonomy Mappings,Notes
Infiltration of Software Development Environment,Detailed,Draft,"An attacker uses common delivery mechanisms such as email attachments or removable media to infiltrate the IDE (Integrated Development Environment) of a victim manufacturer with the intent of implanting malware allowing for attack control of the victim IDE environment. The attack then uses this access to exfiltrate sensitive data or information, manipulate said data or information, and conceal these actions. This will allow and aid the attack to meet the goal of future compromise of a recipient of the victim's manufactured product further down in the supply chain.",,Low,High,::NATURE:ChildOf:CAPEC ID:444::,,::The victim must use email or removable media from systems running the IDE (or systems adjacent to the IDE systems).::The victim must have a system running exploitable applications and/or a vulnerable configuration to allow for initial infiltration.::The attacker must have working knowledge of some if not all of the components involved in the IDE system as well as the infrastructure.::,"::SKILL:Intelligence about the manufacturer's operating environment and infrastructure.:LEVEL:Medium::SKILL:Ability to develop, deploy, and maintain a stealth malicious backdoor program remotely in what is essentially a hostile environment.:LEVEL:High::SKILL:Development skills to construct malicious attachments that can be used to exploit vulnerabilities in typical desktop applications or system configurations. The malicious attachments should be crafted well enough to bypass typical defensive systems (IDS, anti-virus, etc):LEVEL:High::",,,,"::Avoid the common delivery mechanisms of adversaries, such as email attachments, which could introduce the malware.::","::The attacker, knowing the victim runs email on a system adjacent to the IDE system, sends a phishing email with a malicious attachment to the victim. When viewed, the malicious attachment installs a backdoor that allows the attacker to remotely compromise the adjacent IDE system from the victim's workstation. The attacker is then able to exfiltrate sensitive data about the software being developed on the IDE system.::Using rogue versions of Xcode (Apple's app development tool) downloaded from third-party websites, it was possible for the adversary to insert malicious code into legitimate apps during the development process.::",,TAXONOMY NAME:ATTACK:ENTRY ID:1195.001:ENTRY NAME:Supply Chain Compromise: Compromise Software Dependencies and Development Tools::,
Hardware Component Substitution During Baselining,Detailed,Draft,"An adversary with access to system components during allocated baseline development can substitute a maliciously altered hardware component for a baseline component during the product development and research phases. This can lead to adjustments and calibrations being made in the product so that when the final product, now containing the modified component, is deployed it will not perform as designed and be advantageous to the adversary.",,Low,High,::NATURE:ChildOf:CAPEC ID:444::,,::The adversary will need either physical access or be able to supply malicious hardware components to the product development facility.::,::SKILL:Intelligence data on victim's purchasing habits.:LEVEL:Medium::SKILL:Resources to maliciously construct/alter hardware components used for testing by the supplier.:LEVEL:High::SKILL:Resources to physically infiltrate supplier.:LEVEL:High::,,,,"::Hardware attacks are often difficult to detect, as inserted components can be difficult to identify or remain dormant for an extended period of time.::Acquire hardware and hardware components from trusted vendors. Additionally, determine where vendors purchase components or if any components are created/acquired via subcontractors to determine where supply chain risks may exist.::","::An adversary supplies the product development facility of a network security device with a hardware component that is used to simulate large volumes of network traffic. The device claims in logs, stats, and via the display panel to be pumping out very large quantities of network traffic, when it is in fact putting out very low volumes. The developed product is adjusted and configured to handle what it believes to be a heavy network load, but when deployed at the victim site the large volumes of network traffic are dropped instead of being processed by the network security device. This allows the adversary an advantage when attacking the victim in that the adversary's presence may not be detected by the device.::",,TAXONOMY NAME:ATTACK:ENTRY ID:1195.003:ENTRY NAME:Supply Chain Compromise: Compromise Hardware Supply Chain::,
Documentation Alteration to Circumvent Dial-down,Detailed,Draft,"An attacker with access to a manufacturer's documentation, which include descriptions of advanced technology and/or specific components' criticality, alters the documents to circumvent dial-down functionality requirements. This alteration would change the interpretation of implementation and manufacturing techniques, allowing for advanced technologies to remain in place even though these technologies might be restricted to certain customers, such as nations on the terrorist watch list, giving the attacker on the receiving end of a shipped product access to an advanced technology that might otherwise be restricted.",,Low,High,::NATURE:ChildOf:CAPEC ID:447::,,::Advanced knowledge of internal software and hardware components within manufacturer's development environment.::Access to the manufacturer's documentation.::,"::SKILL:Ability to read, interpret, and subsequently alter manufacturer's documentation to prevent dial-down capabilities.:LEVEL:High::SKILL:Ability to stealthly gain access via remote compromise or physical access to the manufacturer's documentation.:LEVEL:High::",,,,::Digitize documents and cryptographically sign them to verify authenticity.::Password protect documents and make them read-only for unauthorized users.::Avoid emailing important documents and configurations.::Ensure deleted files are actually deleted.::Maintain backups of the document for recovery and verification.::,"::A product for manufacture exists that contains advanced cryptographic capabilities, including algorithms that are restricted from being shipped to some nations. An attacker from one of the restricted nations alters the documentation to ensure that when the product is manufactured for shipment to a restricted nation, the software compilation steps that normally would prevent the advanced cryptographic capabilities from being included are actually included. When the product is shipped to the attacker's home country, the attacker is able to retrieve and/or use the advanced cryptographic capabilities.::",,,
Documentation Alteration to Produce Under-performing Systems,Detailed,Draft,"An attacker with access to a manufacturer's documentation alters the descriptions of system capabilities with the intent of causing errors in derived system requirements, impacting the overall effectiveness and capability of the system, allowing an attacker to take advantage of the introduced system capability flaw once the system is deployed.",,Low,High,::NATURE:ChildOf:CAPEC ID:447::,,::Advanced knowledge of software and hardware capabilities of a manufacturer's product.::Access to the manufacturer's documentation.::,"::SKILL:Ability to read, interpret, and subsequently alter manufacturer's documentation to misrepresent system capabilities.:LEVEL:High::SKILL:Ability to stealthly gain access via remote compromise or physical access to the manufacturer's documentation.:LEVEL:High::",,,,::Digitize documents and cryptographically sign them to verify authenticity.::Password protect documents and make them read-only for unauthorized users.::Avoid emailing important documents and configurations.::Ensure deleted files are actually deleted.::Maintain backups of the document for recovery and verification.::Separate need-to-know information from system configuration information depending on the user.::,"::A security subsystem involving encryption is a part of a product, but due to the demands of this subsystem during operation, the subsystem only runs when a specific amount of memory and processing is available. An attacker alters the descriptions of the system capabilities so that when deployed with the minimal requirements at the victim location, the encryption subsystem is never operational, leaving the system in a weakened security state.::",,,
Documentation Alteration to Cause Errors in System Design,Detailed,Draft,An attacker with access to a manufacturer's documentation containing requirements allocation and software design processes maliciously alters the documentation in order to cause errors in system design. This allows the attacker to take advantage of a weakness in a deployed system of the manufacturer for malicious purposes.,,Low,High,::NATURE:ChildOf:CAPEC ID:447::,,::Advanced knowledge of software capabilities of a manufacturer's product.::Access to the manufacturer's documentation.::,"::SKILL:Ability to read, interpret, and subsequently alter manufacturer's documentation to cause errors in system design.:LEVEL:High::SKILL:Ability to stealthly gain access via remote compromise or physical access to the manufacturer's documentation.:LEVEL:High::",,,,::Digitize documents and cryptographically sign them to verify authenticity.::Password protect documents and make them read-only for unauthorized users.::Avoid emailing important documents and configurations.::Ensure deleted files are actually deleted.::Maintain multiple instances of the document across different privileged users for recovery and verification.::,"::During operation, a firewall will restart various subsystems to reload and implement new rules as added by the user. An attacker alters the software design dependencies in the manufacturer's documentation so that under certain predictable conditions the reload will fail to load in rules resulting in a fail open state. Once deployed at a victim site, this will allow the attacker to bypass the victim's firewall.::",,,
Counterfeit Hardware Component Inserted During Product Assembly,Detailed,Draft,An adversary with either direct access to the product assembly process or to the supply of subcomponents used in the product assembly process introduces counterfeit hardware components into product assembly. The assembly containing the counterfeit components results in a system specifically designed for malicious purposes.,,Low,High,::NATURE:ChildOf:CAPEC ID:444::,,::The adversary will need either physical access or be able to supply malicious hardware components to the product development facility.::,::SKILL:Resources to maliciously construct components used by the manufacturer.:LEVEL:High::SKILL:Resources to physically infiltrate manufacturer or manufacturer's supplier.:LEVEL:High::,,,,"::Hardware attacks are often difficult to detect, as inserted components can be difficult to identify or remain dormant for an extended period of time.::Acquire hardware and hardware components from trusted vendors. Additionally, determine where vendors purchase components or if any components are created/acquired via subcontractors to determine where supply chain risks may exist.::","::A manufacturer of a firewall system requires a hardware card which functions as a multi-jack ethernet card with four ethernet ports. The adversary constructs a counterfeit card that functions normally except that packets from the adversary's network are allowed to bypass firewall processing completely. Once deployed at a victim location, this allows the adversary to bypass the firewall unrestricted.::In 2018 it was discovered that Chinese spies infiltrated several U.S. government agencies and corporations as far back as 2015 by including a malicious microchip within the motherboard of servers sold by Elemental Technologies to the victims. Although these servers were assembled via a U.S. based company, the motherboards used within the servers were manufactured and maliciously altered via a Chinese subcontractor. Elemental Technologies then sold these malicious servers to various U.S. government agencies, such as the DoD and CIA, and corporations like Amazon and Apple. The malicious microchip provided adversaries with a backdoor into the system, which further allowed them to access any network that contained the exploited systems, to exfiltrate data to be sent to the Chinese government.[REF-713]::",,TAXONOMY NAME:ATTACK:ENTRY ID:1195.003:ENTRY NAME:Supply Chain Compromise: Compromise Hardware Supply Chain::,
Hardware Design Specifications Are Altered,Detailed,Draft,"An attacker with access to a manufacturer's hardware manufacturing process documentation alters the design specifications, which introduces flaws advantageous to the attacker once the system is deployed.",,Low,High,::NATURE:ChildOf:CAPEC ID:447::,,::Advanced knowledge of hardware capabilities of a manufacturer's product.::Access to the manufacturer's documentation.::,"::SKILL:Ability to read, interpret, and subsequently alter manufacturer's documentation to cause errors in design specifications.:LEVEL:High::SKILL:Ability to stealthly gain access via remote compromise or physical access to the manufacturer's documentation.:LEVEL:High::",,,,::Digitize documents and cryptographically sign them to verify authenticity.::Password protect documents and make them read-only for unauthorized users.::Avoid emailing important documents and configurations.::Ensure deleted files are actually deleted.::Maintain backups of the document for recovery and verification.::Separate need-to-know information from system configuration information depending on the user.::,"::To operate at full capability, a manufacturer's network intrusion detection device needs to have either a Intel Xeon E7-2820 or AMD FX-8350 which have 8 cores available, allowing for advanced threading needed to handle large volumes of network traffic without resorting to dropping packets from the detection process. The attacker alters the documentation to state that the system design must use the Intel Core Duo or the AMD Phenom II X2, which only have 2 cores, causing the system to drop large amounts of packets during deployment at a victim site with large amounts of network traffic.::",,,
Malicious Hardware Component Replacement,Standard,Draft,"An adversary replaces legitimate hardware in the system with faulty counterfeit or tampered hardware in the supply chain distribution channel, with purpose of causing malicious disruption or allowing for additional compromise when the system is deployed.",,Low,High,::NATURE:ChildOf:CAPEC ID:439::,"::STEP:1:PHASE:Explore:DESCRIPTION:[Determine Target Hardware] The adversary must first identify a system that they wish to target, and a specific hardware component that they can swap out with a malicious replacement.:TECHNIQUE:Look for datasheets containing the system schematics that can help identify possible target hardware.:TECHNIQUE:Procure a system and inspect it manually, looking for possible hardware component targets. Search for manufacturer IDs on hardware chips or FCC IDs on wireless chips to determine their functionality.::STEP:2:PHASE:Explore:DESCRIPTION:[Discover Vulnerability in Supply Chain] The adversary maps out the supply chain for the targeted system. They look for ooportunities to gain physical access to the system after it has left the manufacturer, but before it is deployed to the victim.:TECHNIQUE:Procure a system and observe the steps it takes in the shipment process.:TECHNIQUE:Identify possible warehouses that systems are stored after manufacturing.::STEP:3:PHASE:Experiment:DESCRIPTION:[Test a Malicious Component Replacement] Before performing the attack in the wild, an adversary will test the attack on a system they have procured to ensure that the desired outcome will be achieved.:TECHNIQUE:Design a malicious hardware component that will perform the same functionality as the target component, but also contains additional functionality.:TECHNIQUE:Obtain already designed malicious components that just need to be placed into the system.::STEP:3:PHASE:Exploit:DESCRIPTION:[Substitute Components in the Supply Chain] Using the vulnerability in the supply chain of the system discovered in the explore phase, the adversary substitutes the malicious component for the targeted component. This results in the adversary gaining unintended access to systems once they reach the victim and can lead to a variety of follow up attacks.::",::Physical access to the system after it has left the manufacturer but before it is deployed at the victim location.::,::SKILL:Advanced knowledge of the design of the system.:LEVEL:High::SKILL:Hardware creation and manufacture of replacement components.:LEVEL:High::,,,,"::Ensure that all contractors and sub-suppliers use trusted means of shipping (e.g., bonded/cleared/vetted and insured couriers) to ensure that components, once purchased, are not subject to compromise during their delivery.::Prevent or detect tampering with critical hardware or firmware components while in transit through use of state-of-the-art anti-tamper devices.::Use tamper-resistant and tamper-evident packaging when shipping critical components (e.g., plastic coating for circuit boards, tamper tape, paint, sensors, and/or seals for cases and containers) and inspect received system components for evidence of tampering.::","::During shipment the adversary is able to intercept a system that has been purchased by the victim, and replaces a math processor card that functions just like the original, but contains advanced malicious capability. Once deployed, the system functions as normal, but allows for the adversary to remotely communicate with the system and use it as a conduit for additional compromise within the victim's environment.::",,TAXONOMY NAME:ATTACK:ENTRY ID:1195.003:ENTRY NAME:Supply Chain Compromise: Compromise Hardware Supply Chain::,
Malicious Software Implanted,Standard,Draft,"An attacker implants malicious software into the system in the supply chain distribution channel, with purpose of causing malicious disruption or allowing for additional compromise when the system is deployed.",,Low,High,::NATURE:ChildOf:CAPEC ID:439::,"::STEP:1:PHASE:Explore:DESCRIPTION:[Determine Entry Point] The adversary must first identify a system that they wish to target and search for an entry point they can use to install the malicious software. This could be a system which they have prior knowledge of, giving them insight into the software and environment.:TECHNIQUE:Use a JTAGulator to identify exposed JTAG and UART interfaces in smaller embedded systems.:TECHNIQUE:Identify exposed USB connectors that could be used to load software.::STEP:2:PHASE:Explore:DESCRIPTION:[Discover Vulnerability in Supply Chain] The adversary maps out the supply chain for the targeted system. They look for ooportunities to gain physical access to the system after it has left the manufacturer, but before it is deployed to the victim.:TECHNIQUE:Procure a system and observe the steps it takes in the shipment process.:TECHNIQUE:Identify possible warehouses that systems are stored after manufacturing.::STEP:3:PHASE:Experiment:DESCRIPTION:[Test Malicious Software] Before performing the attack in the wild, an adversary will test the attack on a system they have procured to ensure that the desired outcome will be achieved.:TECHNIQUE:Design malicious software that will give an adversary a backdoor into the system once it is deployed to the victim.:TECHNIQUE:Obtain already designed malicious software that just need to be placed into the system.::STEP:4:PHASE:Exploit:DESCRIPTION:[Implant Software in the Supply Chain] Using the vulnerability in the supply chain of the system discovered in the explore phase, the adversary implants the malicious software into the system. This results in the adversary gaining unintended access to systems once they reach the victim and can lead to a variety of follow up attacks.::",::Physical access to the system after it has left the manufacturer but before it is deployed at the victim location.::,::SKILL:Advanced knowledge of the design of the system and it's operating system components and subcomponents.:LEVEL:High::SKILL:Malicious software creation.:LEVEL:High::,,,,"::Deploy strong code integrity policies to allow only authorized apps to run.::Use endpoint detection and response solutions that can automaticalkly detect and remediate suspicious activities.::Maintain a highly secure build and update infrastructure by immediately applying security patches for OS and software, implementing mandatory integrity controls to ensure only trusted tools run, and requiring multi-factor authentication for admins.::Require SSL for update channels and implement certificate transparency based verification.::Sign everything, including configuration files, XML files and packages.::Develop an incident response process, disclose supply chain incidents and notify customers with accurate and timely information.::","::An attacker has created a piece of malicious software designed to function as a backdoor in a system that is to be deployed at the victim location. During shipment of the system, the attacker has physical access to the system at a loading dock of an integrator for a short time. The attacker unpacks and powers up the system and installs the malicious piece of software, and configures it to run upon system boot. The system is repackaged and returned to its place on the loading dock, and is shipped and installed at the victim location with the malicious software in place, allowing the attacker to bypass firewalls and remotely gain access to the victim's network for further malicious activities.::",,TAXONOMY NAME:ATTACK:ENTRY ID:1195.002:ENTRY NAME:Supply Chain Compromise: Compromise Software Supply Chain::,
Rogue Integration Procedures,Standard,Draft,An attacker alters or establishes rogue processes in an integration facility in order to insert maliciously altered components into the system. The attacker would then supply the malicious components. This would allow for malicious disruption or additional compromise when the system is deployed.,,Low,High,::NATURE:ChildOf:CAPEC ID:439::,,::Physical access to an integration facility that prepares the system before it is deployed at the victim location.::,::SKILL:Advanced knowledge of the design of the system.:LEVEL:High::SKILL:Hardware creation and manufacture of replacement components.:LEVEL:High::,,,,"::Deploy strong code integrity policies to allow only authorized apps to run.::Use endpoint detection and response solutions that can automaticalkly detect and remediate suspicious activities.::Maintain a highly secure build and update infrastructure by immediately applying security patches for OS and software, implementing mandatory integrity controls to ensure only trusted tools run, and requiring multi-factor authentication for admins.::Require SSL for update channels and implement certificate transparency based verification.::Sign everything, including configuration files, XML files and packages.::Develop an incident response process, disclose supply chain incidents and notify customers with accurate and timely information.::Maintain strong physical system access controls and monitor networks and physical facilities for insider threats.::","::An attacker gains access to a system integrator's documentation for the preparation of purchased systems designated for deployment at the victim's location. As a part of the preparation, the included 100 megabit network card is to be replaced with a 1 gigabit network card. The documentation is altered to reflect the type of 1 gigabit network card to use, and the attacker ensures that this type of network card is provided by the attacker's own supply. The card has additional malicious functionality which will allow for additional compromise by the attacker at the victim location once the system is deployed.::",,,
Provide Counterfeit Component,Detailed,Draft,"An attacker provides a counterfeit component during the procurement process of a lower-tier component supplier to a sub-system developer or integrator, which is then built into the system being upgraded or repaired by the victim, allowing the attacker to cause disruption or additional compromise.",,Low,High,::NATURE:ChildOf:CAPEC ID:531::,,::Advanced knowledge about the target system and sub-components.::,::SKILL:Able to develop and manufacture malicious system components that resemble legitimate name-brand components.:LEVEL:High::,,,,::There are various methods to detect if the component is a counterfeit. See section II of [REF-703] for many techniques.::,"::The attacker, aware that the victim has contracted with an integrator for system maintenance and that the integrator uses commercial-off-the-shelf network hubs, develops their own network hubs with a built-in malicious capability for remote access, the malicious network hubs appear to be a well-known brand of network hub but are not. The attacker then advertises to the sub-system integrator that they are a legit supplier of network hubs, and offers them at a reduced price to entice the integrator to purchase these network hubs. The integrator then installs the attacker's hubs at the victim's location, allowing the attacker to remotely compromise the victim's network.::",,,
