Name,Abstraction,Status,Description,Alternate Terms,Likelihood Of Attack,Typical Severity,Related Attack Patterns,Execution Flow,Prerequisites,Skills Required,Resources Required,Indicators,Consequences,Mitigations,Example Instances,Related Weaknesses,Taxonomy Mappings,Notes
Hardware Component Substitution,Detailed,Draft,"An attacker substitutes out a tested and approved hardware component for a maliciously-altered hardware component. This type of attack is carried out directly on the system, enabling the attacker to then cause disruption or additional compromise.",,Low,High,::NATURE:ChildOf:CAPEC ID:534::,,::Physical access to the system or the integration facility where hardware components are kept.::,::SKILL:Able to develop and manufacture malicious system components that perform the same functions and processes as their non-malicious counterparts.:LEVEL:High::,,,,,"::An attacker has access to an organization's warehouse of card readers being included as a part of an overall security system. By replacing a critical hardware component in the card reader, the attacker is able to alter the function of the card reader to allow an attacker-supplied card to bypass a security checkpoint. The card reader is placed in the warehouse, and later used in the victim's security system. The attacker is then able to go to the victim and use their own card and bypass a physical security checkpoint and gain access to the victim's location for further malicious activity.::",,TAXONOMY NAME:ATTACK:ENTRY ID:1195.003:ENTRY NAME:Supply Chain Compromise: Compromise Hardware Supply Chain::,
Altered Installed BIOS,Detailed,Stable,"An attacker with access to download and update system software sends a maliciously altered BIOS to the victim or victim supplier/integrator, which when installed allows for future exploitation.",,Low,High,::NATURE:ChildOf:CAPEC ID:444::,,::Advanced knowledge about the installed target system design.::Advanced knowledge about the download and update installation processes.::Access to the download and update system(s) used to deliver BIOS images.::,"::SKILL:Able to develop a malicious BIOS image with the original functionality as a normal BIOS image, but with added functionality that allows for later compromise and/or disruption.:LEVEL:High::",,,,"::Deploy strong code integrity policies to allow only authorized apps to run.::Use endpoint detection and response solutions that can automaticalkly detect and remediate suspicious activities.::Maintain a highly secure build and update infrastructure by immediately applying security patches for OS and software, implementing mandatory integrity controls to ensure only trusted tools run, and requiring multi-factor authentication for admins.::Require SSL for update channels and implement certificate transparency based verification.::Sign update packages and BIOS patches.::Use hardware security modules/trusted platform modules to verify authenticity using hardware-based cryptography.::","::An attacker compromises the download and update portion of a manufacturer's web presence, and develops a malicious BIOS that in addition to the normal functionality will also at a specific time of day disable the remote access subsystem's security checks. The malicious BIOS is put in place on the manufacturer's website, the victim location is sent an official-looking email informing the victim of the availability of a new BIOS with bug fixes and enhanced performance capabilities to entice the victim to install the new BIOS quickly. The malicious BIOS is downloaded and installed on the victim's system, which allows for additional compromise by the attacker.::",,TAXONOMY NAME:ATTACK:ENTRY ID:1495:ENTRY NAME:Firmware Corruption::::TAXONOMY NAME:ATTACK:ENTRY ID:1542.001:ENTRY NAME:Pre-OS Boot:System Firmware::,
Malicious Manual Software Update,Detailed,Draft,"An attacker introduces malicious code to the victim's system by altering the payload of a software update, allowing for additional compromise or site disruption at the victim location. These manual, or user-assisted attacks, vary from requiring the user to download and run an executable, to as streamlined as tricking the user to click a URL. Attacks which aim at penetrating a specific network infrastructure often rely upon secondary attack methods to achieve the desired impact. Spamming, for example, is a common method employed as an secondary attack vector. Thus the attacker has in their arsenal a choice of initial attack vectors ranging from traditional SMTP/POP/IMAP spamming and its varieties, to web-application mechanisms which commonly implement both chat and rich HTML messaging within the user interface.",,Low,High,::NATURE:ChildOf:CAPEC ID:186::,,::Advanced knowledge about the download and update installation processes.::Advanced knowledge about the deployed system and its various software subcomponents and processes.::,::SKILL:Able to develop malicious code that can be used on the victim's system while maintaining normal functionality.:LEVEL:High::,,,,::Only accept software updates from an official source.::,"::An email campaign was initiated, targetting victims of a ransomware attack. The email claimed to be a patch to address the ransomware attack, but was instead an attachment that caused the Cobalt Strike tools to be installed, which enabled further attacks.::",::494::,,
Malicious Hardware Update,Standard,Stable,"An adversary introduces malicious hardware during an update or replacement procedure, allowing for additional compromise or site disruption at the victim location. After deployment, it is not uncommon for upgrades and replacements to occur involving hardware and various replaceable parts. These upgrades and replacements are intended to correct defects, provide additional features, and to replace broken or worn-out parts. However, by forcing or tricking the replacement of a good component with a defective or corrupted component, an adversary can leverage known defects to obtain a desired malicious impact.",,Low,High,::NATURE:ChildOf:CAPEC ID:440::,,,::SKILL:Able to develop and manufacture malicious hardware components that perform the same functions and processes as their non-malicious counterparts.:LEVEL:High::,,,,,"::An adversary develops a malicious networking card that allows for normal function plus the addition of malicious functionality that is of benefit to the adversary. The adversary sends the victim an email stating that the existing networking card is faulty, and that the victim can order a replacement card free of charge. The victim orders the card, and the adversary sends the malicious networking card. The malicious networking card replaces the perfectly-functioning original networking card, and the adversary is able to take advantage of the additional malicious functionality to further compromise the victim's network.::",,,
Malicious Gray Market Hardware,Detailed,Draft,"An attacker maliciously alters hardware components that will be sold on the gray market, allowing for victim disruption and compromise when the victim needs replacement hardware components for systems where the parts are no longer in regular supply from original suppliers, or where the hardware components from the attacker seems to be a great benefit from a cost perspective.",,Low,High,::NATURE:ChildOf:CAPEC ID:531::,,"::Physical access to a gray market reseller's hardware components supply, or the ability to appear as a gray market reseller to the victim's buyer.::",::SKILL:Able to develop and manufacture malicious hardware components that perform the same functions and processes as their non-malicious counterparts.:LEVEL:High::,,,,::Purchase only from authorized resellers.::Validate serial numbers from multiple sources::,"::An attacker develops co-processor boards with malicious capabilities that are technically the same as a manufacturer's expensive upgrade to their flagship system. The victim has installed the manufacturer's base system without the expensive upgrade. The attacker contacts the victim and states they have the co-processor boards at a drastically-reduced price, falsely stating they were acquired from a bankruptcy liquidation of a company that had purchased them from the manufacturer. The victim after hearing the drastically reduced price decides to take advantage of the situation and purchases the upgrades from the attacker, and installs them. This allows the attacker to further compromise the victim.::",,,
Data Injected During Configuration,Standard,Stable,"An attacker with access to data files and processes on a victim's system injects malicious data into critical operational data during configuration or recalibration, causing the victim's system to perform in a suboptimal manner that benefits the adversary.",,Low,High,::NATURE:ChildOf:CAPEC ID:176::,"::STEP:1:PHASE:Explore:DESCRIPTION:[Determine configuration process] The adversary, through a previously compromised system, either remotely or physically, determines what the configuration process is. They look at configuration files, data files, and running processes on the system to identify areas where they could inject malicious data.::STEP:2:PHASE:Explore:DESCRIPTION:[Determine when configuration occurs] The adversary needs to then determine when configuration or recalibration of a system occurs so they know when to inject malicious data.:TECHNIQUE:Look for a weekly update cycle or repeated update schedule.:TECHNIQUE:Insert a malicious process into the target system that notifies the adversary when configuration is occurring.::STEP:3:PHASE:Experiment:DESCRIPTION:[Determine malicious data to inject] By looking at the configuration process, the adversary needs to determine what malicious data they want to insert and where to insert it.:TECHNIQUE:Add false log data:TECHNIQUE:Change configuration files:TECHNIQUE:Change data files::STEP:4:PHASE:Exploit:DESCRIPTION:[Inject malicious data] Right before, or during system configuration, the adversary injects the malicious data. This leads to the system behaving in a way that is beneficial to the adversary and is often followed by other attacks.::",::The attacker must have previously compromised the victim's systems or have physical access to the victim's systems.::Advanced knowledge of software and hardware capabilities of a manufacturer's product.::,::SKILL:Ability to generate and inject false data into operational data into a system with the intent of causing the victim to alter the configuration of the system.:LEVEL:High::,,,,::Ensure that proper access control is implemented on all systems to prevent unauthorized access to system files and processes.::,"::An adversary wishes to bypass a security system to access an additional network segment where critical data is kept. The adversary knows that some configurations of the security system will allow for remote bypass under certain conditions, such as switching a specific parameter to a different value. The adversary knows the bypass will work but also will be detected within the logging data of the security system. The adversary waits until an upgrade is performed to the security system by the victim's system administrators, and the adversary has access to an external logging system. The adversary injects false log entries that cause the administrators to think there are two different error states within the security system - one involving the specific parameter and the other involving the logging entries. The specific parameter is adjusted to a different value, and the logging level is reduced to a lower level that will not cause an adversary bypass to be detected. The adversary stops injecting false log data, and the administrators of the security system believe the issues were caused by the upgrade and are now resolved. The adversary is then able to bypass the security system.::",::284::,,
Infiltration of Hardware Development Environment,Detailed,Draft,"An adversary, leveraging the ability to manipulate components of primary support systems and tools within the development and production environments, inserts malicious software within the hardware and/or firmware development environment. The infiltration purpose is to alter developed hardware components in a system destined for deployment at the victim's organization, for the purpose of disruption or further compromise.",,Low,High,::NATURE:ChildOf:CAPEC ID:444::,,::The victim must use email or removable media from systems running the IDE (or systems adjacent to the IDE systems).::The victim must have a system running exploitable applications and/or a vulnerable configuration to allow for initial infiltration.::The adversary must have working knowledge of some if not all of the components involved in the IDE system as well as the infrastructure.::,"::SKILL:Intelligence about the manufacturer's operating environment and infrastructure.:LEVEL:Medium::SKILL:Ability to develop, deploy, and maintain a stealth malicious backdoor program remotely in what is essentially a hostile environment.:LEVEL:High::SKILL:Development skills to construct malicious attachments that can be used to exploit vulnerabilities in typical desktop applications or system configurations. The malicious attachments should be crafted well enough to bypass typical defensive systems (IDS, anti-virus, etc):LEVEL:High::",,,,"::Verify software downloads and updates to ensure they have not been modified be adversaries::Leverage antivirus tools to detect known malware::Do not download software from untrusted sources::Educate designers, developers, engineers, etc. on social engineering attacks to avoid downloading malicious software via attacks such as phishing attacks::","::The adversary, knowing the manufacturer runs email on a system adjacent to the hardware development systems used for hardware and/or firmware design, sends a phishing email with a malicious attachment to the manufacturer. When viewed, the malicious attachment installs a backdoor that allows the adversary to remotely compromise the adjacent hardware development system from the manufacturer's workstation. The adversary is then able to exfiltrate and alter sensitive data on the hardware system, allowing for future compromise once the developed system is deployed at the victim location.::",,TAXONOMY NAME:ATTACK:ENTRY ID:1195.003:ENTRY NAME:Supply Chain Compromise: Compromise Hardware Supply Chain::,
Open-Source Library Manipulation,Detailed,Stable,"Adversaries implant malicious code in open source software (OSS) libraries to have it widely distributed, as OSS is commonly downloaded by developers and other users to incorporate into software development projects. The adversary can have a particular system in mind to target, or the implantation can be the first stage of follow-on attacks on many systems.",,Low,High,::NATURE:ChildOf:CAPEC ID:444::,"::STEP:1:PHASE:Explore:DESCRIPTION:[Determine the relevant open-source code project to target] The adversary will make the selection based on various criteria: The open-source code currently in use on a selected target system. The depth in the dependency graph of the open source code in relationship to other code bases in use on the target system. Choosing an OSS lower in the graph decreases the probability of discovery, but also decreases the scope of its use within the target system. The programming language in which the open source code is implemented. Different languages present different opportunities for using known software weaknesses. The quality of processes in place to make a contribution. For instance, some contribution sites use static and dynamic analysis tools, which could increase the probability of discovery. The security requirements necessary to make a contribution. For instance, is the ownership lax allowing unsigned commits or anonymous users.::STEP:2:PHASE:Experiment:DESCRIPTION:[Develop a plan for malicious contribution] The adversary develops a plan to contribute malicious code, taking the following into consideration: The adversary will probably avoid easy-to-find software weaknesses, especially ones that static and dynamic analysis tools are likely to discover. Common coding errors or missing edge cases of the algorithm, which can be explained away as being accidental, if discovered, will be preferred by the adversary. Sometimes no identity is required to make a contribution. Other options are to steal an existing identity or create one. When creating a new identity, strike a balance between too little or too much detail. Using an stolen identity could cause a notification to be sent to the actual user.::STEP:3:PHASE:Exploit:DESCRIPTION:[Execute the plan for malicious contribution] Write the code to be contributed based on the plan and then submit the contribution. Multiple commits, possibly using multiple identities, will help obscure the attack. Monitor the contribution site to try to determine if the code has been uploaded to the target system.::",::Access to the open source code base being used by the manufacturer in a system being developed or currently deployed at a victim location.::,::SKILL:Advanced knowledge about the inclusion and specific usage of an open source code project within system being targeted for infiltration.:LEVEL:High::,,,,,::An adversary with access to an open source code project introduces a hard-to-find bug in the software that allows under very specific conditions for encryption to be disabled on data streams. The adversary commits the change to the code which is picked up by a manufacturer who develops VPN software. It is eventually deployed at the victim's location where the very specific conditions are met giving the adversary the ability to sniff plaintext traffic thought to be encrypted. This can provide to the adversary access to sensitive data of the victim.::,::494::829::,TAXONOMY NAME:ATTACK:ENTRY ID:1195.001:ENTRY NAME:Supply Chain Compromise: Software Dependencies and Development Tools::,
ASIC With Malicious Functionality,Detailed,Draft,An attacker with access to the development environment process of an application-specific integrated circuit (ASIC) for a victim system being developed or maintained after initial deployment can insert malicious functionality into the system for the purpose of disruption or further compromise.,,Low,High,::NATURE:ChildOf:CAPEC ID:444::,,::The attacker must have working knowledge of some if not all of the components involved in the target system as well as the infrastructure and development environment of the manufacturer.::Advanced knowledge about the ASIC installed within the target system.::,::SKILL:Able to develop and manufacture malicious subroutines for an ASIC environment without degradation of existing functions and processes.:LEVEL:High::,,,,,"::A hardware manufacturer periodically updates its ASIC with new features. The attacker, knowing the manufacturer runs email on a system adjacent to the hardware development systems used for ASIC design, sends a phishing email with a malicious attachment to the manufacturer. When viewed, the malicious attachment installs a backdoor that allows the attacker to remotely compromise the adjacent ASIC development system. The attacker is then able to exfiltrate and alter sensitive data on the ASIC system, allowing for future compromise once a new AISC is deployed at the victim location.::",,TAXONOMY NAME:ATTACK:ENTRY ID:1195.003:ENTRY NAME:Supply Chain Compromise: Compromise Hardware Supply Chain::,
Rooting SIM Cards,Detailed,Draft,"SIM cards are the de facto trust anchor of mobile devices worldwide. The cards protect the mobile identity of subscribers, associate devices with phone numbers, and increasingly store payment credentials, for example in NFC-enabled phones with mobile wallets. This attack leverages over-the-air (OTA) updates deployed via cryptographically-secured SMS messages to deliver executable code to the SIM. By cracking the DES key, an attacker can send properly signed binary SMS messages to a device, which are treated as Java applets and are executed on the SIM. These applets are allowed to send SMS, change voicemail numbers, and query the phone location, among many other predefined functions. These capabilities alone provide plenty of potential for abuse.",,,High,::NATURE:ChildOf:CAPEC ID:186::,,::A SIM card that relies on the DES cipher.::,"::SKILL:This is a sophisticated attack, but detailed techniques are published in open literature.:LEVEL:Medium::",,,::SCOPE:Confidentiality:SCOPE:Integrity:TECHNICAL IMPACT:Execute Unauthorized Commands::,::Upgrade the SIM card to use the state-of-the-art AES or the somewhat outdated 3DES algorithm for OTA.::,,::327::,,
Malicious Automated Software Update via Spoofing,Detailed,Draft,"An attackers uses identify or content spoofing to trick a client into performing an automated software update from a malicious source. A malicious automated software update that leverages spoofing can include content or identity spoofing as well as protocol spoofing. Content or identity spoofing attacks can trigger updates in software by embedding scripted mechanisms within a malicious web page, which masquerades as a legitimate update source. Scripting mechanisms communicate with software components and trigger updates from locations specified by the attackers' server. The result is the client believing there is a legitimate software update available but instead downloading a malicious update from the attacker.",,High,High,::NATURE:ChildOf:CAPEC ID:186::,,,,,,::SCOPE:Access Control:SCOPE:Availability:SCOPE:Confidentiality:TECHNICAL IMPACT:Execute Unauthorized Commands::,,::An example of the spoofing strategy would be the eTrust Antivirus Webscan Automated Update Remote Code Execution vulnerability (CVE-2006-3976) and (CVE-2006-3977) whereby an ActiveX control could be remotely manipulated by an attacker controlled web page to download and execute the attackers' code without integrity checking.::,::494::,TAXONOMY NAME:ATTACK:ENTRY ID:1072:ENTRY NAME:Software Deployment Tools::,
