Name,Abstraction,Status,Description,Alternate Terms,Likelihood Of Attack,Typical Severity,Related Attack Patterns,Execution Flow,Prerequisites,Skills Required,Resources Required,Indicators,Consequences,Mitigations,Example Instances,Related Weaknesses,Taxonomy Mappings,Notes
Software Integrity Attack,Meta,Draft,"An attacker initiates a series of events designed to cause a user, program, server, or device to perform actions which undermine the integrity of software code, device data structures, or device firmware, achieving the modification of the target's integrity to achieve an insecure state.",,,Low,,,,::SKILL:Manual or user-assisted attacks require deceptive mechanisms to trick the user into clicking a link or downloading and installing software. Automated update attacks require the attacker to host a payload and then trigger the installation of the payload code.:LEVEL:Medium::,"::Software Integrity Attacks are usually a late stage focus of attack activity which depends upon the success of a chain of prior events. The resources required to perform the attack vary with respect to the overall attack strategy, existing countermeasures which must be bypassed, and the success of early phase attack vectors.::",,,,,::494::,,
Malicious Software Download,Standard,Draft,An attacker uses deceptive methods to cause a user or an automated process to download and install dangerous code that originates from an attacker controlled source. There are several variations to this strategy of attack.,,,Very High,::NATURE:ChildOf:CAPEC ID:184::NATURE:CanPrecede:CAPEC ID:662::,,,,,,,,,::494::,,
Malicious Software Update,Standard,Draft,An adversary uses deceptive methods to cause a user or an automated process to download and install dangerous code believed to be a valid update that originates from an adversary controlled source.,,,High,::NATURE:ChildOf:CAPEC ID:184::NATURE:CanFollow:CAPEC ID:98::,"::STEP:1:PHASE:Explore:DESCRIPTION:[Identify target] The adversary must first identify what they want their target to be. Because malicious software updates can be carried out in a variety of ways, the adversary will first not only identify a target program, but also what users they wish to target. This attack can be targeted (a particular user or group of users) or untargeted (many different users).::STEP:2:PHASE:Experiment:DESCRIPTION:[Craft a deployment mechanism based on the target] The adversary must craft a deployment mechanism to deploy the malicious software update. This mechanism will differ based on if the attack is targeted or untargeted.:TECHNIQUE:Targeted attack: hosting what appears to be a software update, then harvesting actual email addresses for an organization, or generating commonly used email addresses, and then sending spam, phishing, or spear-phishing emails to the organization's users requesting that they manually download and install the malicious software update.:TECHNIQUE:Targeted attack: Instant Messaging virus payload, which harvests the names from a user's contact list and sends instant messages to those users to download and apply the update:TECHNIQUE:Untargeted attack: Spam the malicious update to as many users as possible through unsolicited email, instant messages, or social media messages.:TECHNIQUE:Untargeted attack: Send phishing emails to as many users as possible and pretend to be a legitimate source suggesting to download an important software update.:TECHNIQUE:Untargeted attack: Use trojans/botnets to aid in either of the two untargeted attacks.::STEP:3:PHASE:Exploit:DESCRIPTION:[Deploy malicious software update] Using the deployment mechanism from the previous step, the adversary gets a user to install the malicious software update.::",,::SKILL:This attack requires advanced cyber capabilities:LEVEL:High::,::Manual or user-assisted attacks require deceptive mechanisms to trick the user into clicking a link or downloading and installing software. Automated update attacks require the adversary to host a payload and then trigger the installation of the payload code.::,,"::SCOPE:Access Control:SCOPE:Availability:SCOPE:Confidentiality:TECHNICAL IMPACT:Execute Unauthorized Commands:NOTE:Utilize the built-in software update mechanisms of the commercial components to deliver software that could compromise security credentials, enable a denial-of-service attack, or enable tracking.::",::Validate software updates before installing.::,::Using an automated process to download and install dangerous code was key part of the NotPeyta attack [REF-697]::,::494::,TAXONOMY NAME:ATTACK:ENTRY ID:1195.002:ENTRY NAME:Supply Chain Compromise: Compromise Software Supply Chain::,"TYPE:Other:NOTE:Other class of attacks focus on firmware, where malicious updates are made to the core system firmware or BIOS. Since this occurs outside the controls of the operating system, the OS detection and prevention mechanisms do not aid, thus allowing an adversary to evade defenses as well as gain persistence on the target's system.::"
Malicious Automated Software Update via Redirection,Detailed,Draft,"An attacker exploits two layers of weaknesses in server or client software for automated update mechanisms to undermine the integrity of the target code-base. The first weakness involves a failure to properly authenticate a server as a source of update or patch content. This type of weakness typically results from authentication mechanisms which can be defeated, allowing a hostile server to satisfy the criteria that establish a trust relationship. The second weakness is a systemic failure to validate the identity and integrity of code downloaded from a remote location, hence the inability to distinguish malicious code from a legitimate update.",,High,High,::NATURE:ChildOf:CAPEC ID:186::,,,,,,::SCOPE:Access Control:SCOPE:Availability:SCOPE:Confidentiality:TECHNICAL IMPACT:Execute Unauthorized Commands::,,,::494::,TAXONOMY NAME:ATTACK:ENTRY ID:1072:ENTRY NAME:Software Deployment Tools::,
Signing Malicious Code,Detailed,Draft,"The adversary extracts credentials used for code signing from a production environment and then uses these credentials to sign malicious content with the developer's key. Many developers use signing keys to sign code or hashes of code. When users or applications verify the signatures are accurate they are led to believe that the code came from the owner of the signing key and that the code has not been modified since the signature was applied. If the adversary has extracted the signing credentials then they can use those credentials to sign their own code bundles. Users or tools that verify the signatures attached to the code will likely assume the code came from the legitimate developer and install or run the code, effectively allowing the adversary to execute arbitrary code on the victim's computer. This differs from CAPEC-673, because the adversary is performing the code signing.",,,Very High,::NATURE:ChildOf:CAPEC ID:444::,"::STEP:1:PHASE:Explore:DESCRIPTION:The adversary first attempts to obtain a digital certificate in order to sign their malware or tools. This certificate could be stolen, created by the adversary, or acquired normally through a certificate authority.::STEP:2:PHASE:Explore:DESCRIPTION:Based on the type of certificate obtained, the adversary will create a goal for their attack. This is either a broad or targeted attack. If an adversary was able to steal a certificate from a targeted organization, they could target this organization by pretending to have legitimate code signed by them. In other cases, the adversary would simply sign their malware and pose as legitimate software such that any user might trust it. This is the more broad approach::STEP:3:PHASE:Experiment:DESCRIPTION:The adversary creates their malware and signs it with the obtained digital certificate. The adversary then checks if the code that they signed is valid either through downloading from the targeted source or testing locally.::STEP:4:PHASE:Exploit:DESCRIPTION:Once the malware has been signed, it is then deployed to the desired location. They wait for a trusting user to run their malware, thinking that it is legitimate software. This malware could do a variety of things based on the motivation of the adversary.::",::The targeted developer must use a signing key to sign code bundles. (Note that not doing this is not a defense - it only means that the adversary does not need to steal the signing key before forging code bundles in the developer's name.)::,,::None: No specialized resources are required to execute this type of attack.::,,,"::Ensure digital certificates are protected and inaccessible by unauthorized uses.::If a digital certificate has been compromised it should be revoked and regenerated.::Even if a piece of software has a valid and trusted digital signature, it should be assessed for any weaknesses and vulnerabilities.::","::In the famous Stuxnet malware incident, two digital certificates were compromised in order to sign malicious device drivers with legitimate credentials. The signing resulted in the malware appearing as trusted by the system it was running on, which facilitated the installation of the malware in kernel mode. This further resulted in Stuxnet remaining undetected for a significant amount of time. [REF-699]::The cyber espionage group CyberKittens leveraged a stolen certificate from AI Squared that allowed them to leverage a signed executable within Operation Wilted Tulip. This ultimately allowed the executable to run as trusted on the system, allowing a Crowd Strike stager to be loaded within the system's memory. [REF-714]::",::732::,TAXONOMY NAME:ATTACK:ENTRY ID:1553.002:ENTRY NAME:Subvert Trust Controls:Code Signing::,
Physically Hacking Hardware,Standard,Stable,An adversary exploits a weakness in access control to gain access to currently installed hardware and precedes to implement changes or secretly replace a hardware component which undermines the system's integrity for the purpose of carrying out an attack.,,Low,High,::NATURE:ChildOf:CAPEC ID:440::,,,,,,,,::A malicious subcontractor or subcontractor's employee that is responsible for system maintenance secretly replaces a hard drive with one containing malicious code that will allow for backdoor access once deployed.::,::1263::,,
Bypassing ATA Password Security,Detailed,Draft,"An adversary exploits a weakness in ATA security on a drive to gain access to the information the drive contains without supplying the proper credentials. ATA Security is often employed to protect hard disk information from unauthorized access. The mechanism requires the user to type in a password before the BIOS is allowed access to drive contents. Some implementations of ATA security will accept the ATA command to update the password without the user having authenticated with the BIOS. This occurs because the security mechanism assumes the user has first authenticated via the BIOS prior to sending commands to the drive. Various methods exist for exploiting this flaw, the most common being installing the ATA protected drive into a system lacking ATA security features (a.k.a. hot swapping). Once the drive is installed into the new system the BIOS can be used to reset the drive password.",,,,::NATURE:ChildOf:CAPEC ID:401::,,::Access to the system containing the ATA Drive so that the drive can be physically removed from the system.::,,,,,"::Avoid using ATA password security when possible.::Use full disk encryption to protect the entire contents of the drive or sensitive partitions on the drive.::Leverage third-party utilities that interface with self-encrypting drives (SEDs) to provide authentication, while relying on the SED itself for data encryption.::","::The A-FF Repair Station tool is a data recovery utility that can be used for ATA password removal (both High and Maximum level) and firmware area recovery. An adversary with access to this tool could reset the ATA password to bypass this security feature and unlock the hard drive. The adversary could then obtain any data contained within the drive. [REF-702]::An adversary gains physical access to the targeted hard drive and installs it into a system that does not support ATA security features. Once the drive is installed in the feature-lacking system, the adversary is able to reset the hard drive password via the BIOS. As a result, the adversary is able to bypass ATA password security and access content on the drive.::",::285::,,
Manipulation During Distribution,Meta,Draft,"An attacker undermines the integrity of a product, software, or technology at some stage of the distribution channel. The core threat of modification or manipulation during distribution arise from the many stages of distribution, as a product may traverse multiple suppliers and integrators as the final asset is delivered. Components and services provided from a manufacturer to a supplier may be tampered with during integration or packaging.",,,,,,,,,,,,"::A malicious OEM provider, or OEM provider employee or contractor, may install software, or modify existing code, during distribution.::External contractors involved in the packaging or testing of products or components may install software, or modify existing code, during distribution.::",::1269::,TAXONOMY NAME:ATTACK:ENTRY ID:1195:ENTRY NAME:Supply Chain Compromise::,
Hardware Integrity Attack,Meta,Stable,"An adversary exploits a weakness in the system maintenance process and causes a change to be made to a technology, product, component, or sub-component or a new one installed during its deployed use at the victim location for the purpose of carrying out an attack.",,Low,High,,,::Influence over the deployed system at a victim location.::,,,,::SCOPE:Integrity:TECHNICAL IMPACT:Execute Unauthorized Commands::,,,,TAXONOMY NAME:ATTACK:ENTRY ID:1195.003:ENTRY NAME:Supply Chain Compromise: Compromise Hardware Supply Chain::::TAXONOMY NAME:ATTACK:ENTRY ID:1200:ENTRY NAME:Hardware Additions::,
Malicious Logic Inserted Into Product by Authorized Developer,Detailed,Stable,An adversary uses their privileged position within an authorized development organization to inject malicious logic into a codebase or product.,,Medium,High,::NATURE:ChildOf:CAPEC ID:444::,,::Access to the product during the initial or continuous development.::,,,,::SCOPE:Authorization:TECHNICAL IMPACT:Execute Unauthorized Commands::,"::Assess software and hardware during development and prior to deployment to ensure that it functions as intended and without any malicious functionality. This includes both initial development, as well as updates propagated to the product after deployment.::","::In January 2022 the author of popular JavaScript packages Faker and colors, used for generating mock data and including colored text within NodeJS consoles respectively, introduced malicious code that resulted in a Denial of Service (DoS) via an infinite loop. When applications that leveraged these packages updated to the malicious version, their applications executed the infinite loop and output gibberish ASCI characters endlessly. This resulted in the application being unusable until a stable version of the package was obtained. [REF-705]::During initial development, an authorized hardware developer implants a malicious microcontroller within an Internet of Things (IOT) device and programs the microcontroller to communicate with the vulnerable device. Each time the device initializes, the malicious microcontroller's code is executed, which ultimately provides the adversary with backdoor access to the vulnerable device. This can further allow the adversary to sniff network traffic, exfiltrate date, execute unauthorized commands, and/or pivot to other vulnerable devices.::",,TAXONOMY NAME:ATTACK:ENTRY ID:1195.002:ENTRY NAME:Supply Chain Compromise: Compromise Software Supply Chain::::TAXONOMY NAME:ATTACK:ENTRY ID:1195.003:ENTRY NAME:Supply Chain Compromise: Compromise Hardware Supply Chain::,
Development Alteration,Standard,Stable,"An adversary modifies a technology, product, or component during its development to acheive a negative impact once the system is deployed. The goal of the adversary is to modify the system in such a way that the negative impact can be leveraged when the system is later deployed. Development alteration attacks may include attacks that insert malicious logic into the system's software, modify or replace hardware components, and other attacks which negatively impact the system during development. These attacks generally require insider access to modify source code or to tamper with hardware components. The product is then delivered to the user where the negative impact can be leveraged at a later time.",,Medium,High,::NATURE:ChildOf:CAPEC ID:438::,,::Access to the system during the development phase to alter and/or modify software and hardware components. This access is often obtained via insider access or by leveraging another attack pattern to gain permissions that the adversary wouldn't normally have.::,,,,::SCOPE:Authorization:TECHNICAL IMPACT:Execute Unauthorized Commands::SCOPE:Availability:TECHNICAL IMPACT:Unreliable Execution::SCOPE:Integrity:TECHNICAL IMPACT:Alter Execution Logic::,::Assess software and software components during development and prior to deployment to ensure that they function as intended and without any malicious functionality.::,,,,
Malicious Logic Insertion into Product Software via Configuration Management Manipulation,Detailed,Stable,"An adversary exploits a configuration management system so that malicious logic is inserted into a software products build, update or deployed environment. If an adversary can control the elements included in a product's configuration management for build they can potentially replace, modify or insert code files containing malicious logic. If an adversary can control elements of a product's ongoing operational configuration management baseline they can potentially force clients receiving updates from the system to install insecure software when receiving updates from the server.",,Medium,High,::NATURE:ChildOf:CAPEC ID:444::,,::Access to the configuration management system during deployment or currently deployed at a victim location. This access is often obtained via insider access or by leveraging another attack pattern to gain permissions that the adversary wouldn't normally have.::,,,,::SCOPE:Authorization:TECHNICAL IMPACT:Execute Unauthorized Commands::,::Assess software during development and prior to deployment to ensure that it functions as intended and without any malicious functionality.::Leverage anti-virus products to detect and quarantine software with known virus.::,"::In 2016, the policy-based configuration management system Chef was shown to be vulnerable to remote code execution attacks based on its Chef Manage add-on improperly deserializing user-driven cookie data. This allowed unauthenticated users the ability to craft cookie data that executed arbitrary code with the web server's privileges. [REF-706]::",,TAXONOMY NAME:ATTACK:ENTRY ID:1195.001:ENTRY NAME:Supply Chain Compromise: Compromise Software Dependencies and Development Tools::,
Malicious Logic Insertion into Product via Inclusion of Third-Party Component,Detailed,Stable,"An adversary conducts supply chain attacks by the inclusion of insecure third-party components into a technology, product, or code-base, possibly packaging a malicious driver or component along with the product before shipping it to the consumer or acquirer.",,Medium,High,::NATURE:ChildOf:CAPEC ID:444::,,::Access to the product during the initial or continuous development. This access is often obtained via insider access to include the third-party component after deployment.::,,,,::SCOPE:Authorization:TECHNICAL IMPACT:Execute Unauthorized Commands::,"::Assess software and hardware during development and prior to deployment to ensure that it functions as intended and without any malicious functionality. This includes both initial development, as well as updates propagated to the product after deployment.::Don't assume popular third-party components are free from malware or vulnerabilities. For software, assess for malicious functionality via update/commit reviews or automated static/dynamic analysis prior to including the component within the application and deploying in a production environment.::","::From mid-2014 to early 2015, Lenovo computers were shipped with the Superfish Visual Search software that ultimately functioned as adware on the system. The Visual Search installation included a self-signed root HTTPS certificate that was able to intercept encrypted traffic for any site visited by the user. Of more concern was the fact that the certificate's corresponding private key was the same for every Lenovo machine. Once the private key was discovered [REF-709], an adversary could then conduct an Adversary-in-the-Middle (AitM) attack that would go undetected by machines that had this certificate installed on it. Adversaries could then masquerade as legitimate entities such as financial institutions, popular corporations, or other secure destinations on the Internet. [REF-708]::In 2018 it was discovered that Chinese spies infiltrated several U.S. government agencies and corporations as far back as 2015 by including a malicious microchip within the motherboard of servers sold by Elemental Technologies to the victims. Although these servers were assembled via a U.S. based company, the motherboards used within the servers were manufactured and maliciously altered via a Chinese subcontractor. Elemental Technologies then sold these malicious servers to various U.S. government agencies, such as the DoD and CIA, and corporations like Amazon and Apple. The malicious microchip provided adversaries with a backdoor into the system, which further allowed them to access any network that contained the exploited systems, to exfiltrate data to be sent to the Chinese government.[REF-713]::",,TAXONOMY NAME:ATTACK:ENTRY ID:1195:ENTRY NAME:Supply Chain Compromise::,
Design Alteration,Standard,Stable,"An adversary modifies the design of a technology, product, or component to acheive a negative impact once the system is deployed. In this type of attack, the goal of the adversary is to modify the design of the system, prior to development starting, in such a way that the negative impact can be leveraged when the system is later deployed. Design alteration attacks differ from development alteration attacks in that design alteration attacks take place prior to development and which then may or may not be developed by the adverary. Design alteration attacks include modifying system designs to degrade system performance, cause unexpected states or errors, and general design changes that may lead to additional vulnerabilities. These attacks generally require insider access to modify design documents, but they may also be spoofed via web communications. The product is then developed and delivered to the user where the negative impact can be leveraged at a later time.",,Medium,High,::NATURE:ChildOf:CAPEC ID:438::,,::Access to system design documentation prior to the development phase. This access is often obtained via insider access or by leveraging another attack pattern to gain permissions that the adversary wouldn't normally have.::Ability to forge web communications to deliver modified design documentation.::,,,,::SCOPE:Authorization:TECHNICAL IMPACT:Execute Unauthorized Commands::SCOPE:Availability:TECHNICAL IMPACT:Unreliable Execution::SCOPE:Integrity:TECHNICAL IMPACT:Alter Execution Logic::,::Assess design documentation prior to development to ensure that they function as intended and without any malicious functionality.::Ensure that design documentation is saved in a secure location and has proper access controls set in place to avoid unnecessary modification.::,,,,
