Name,Abstraction,Status,Description,Alternate Terms,Likelihood Of Attack,Typical Severity,Related Attack Patterns,Execution Flow,Prerequisites,Skills Required,Resources Required,Indicators,Consequences,Mitigations,Example Instances,Related Weaknesses,Taxonomy Mappings,Notes
Exploitation of Transient Instruction Execution,Standard,Stable,"An adversary exploits a hardware design flaw in a CPU implementation of transient instruction execution to expose sensitive data and bypass/subvert access control over restricted resources. Typically, the adversary conducts a covert channel attack to target non-discarded microarchitectural changes caused by transient executions such as speculative execution, branch prediction, instruction pipelining, and/or out-of-order execution. The transient execution results in a series of instructions (gadgets) which construct covert channel and access/transfer the secret data.",,Low,Very High,::NATURE:ChildOf:CAPEC ID:74::NATURE:ChildOf:CAPEC ID:184::NATURE:CanPrecede:CAPEC ID:141::NATURE:PeerOf:CAPEC ID:212::NATURE:PeerOf:CAPEC ID:124::NATURE:PeerOf:CAPEC ID:180::,"::STEP:1:PHASE:Explore:DESCRIPTION:[Survey target application and relevant OS shared code libraries] Adversary identifies vulnerable transient instruction sets and the code/function calls to trigger them as well as instruction sets or code fragments (gadgets) to perform attack.:TECHNIQUE:Utilize Disassembler and Debugger tools to examine and trace instruction set execution of source code and shared code libraries on a system.::STEP:2:PHASE:Explore:DESCRIPTION:[Explore cache and identify impacts] Utilize tools to understand the impact of transient instruction execution upon address spaces and CPU operations.:TECHNIQUE:Run OS or application specific tools that examine the contents of cache.::STEP:1:PHASE:Experiment:DESCRIPTION:[Cause conditions for identified transient instruction set execution] Adversary ensures that specific code/instructions of the target process are executed by CPU, so desired transient instructions are executed.::STEP:2:PHASE:Experiment:DESCRIPTION:[Cause specific secret data to be cached from restricted address space] Executed instruction sets (gadgets) in target address space, initially executed via adversary-chosen transient instructions sets, establish covert channel and transfer secret data across this channel to cache.:TECHNIQUE:Prediction-based - adversary trains CPU to incorrectly predict/speculate conditions for instruction execution to be true, hence executing adversary-chosen transient instructions. These prediction-based methods include: Pattern History Table (PHT)/Input Validation Bypass, Branch Target Buffer (BTB)/Branch Target Injection, Return Stack Buffer (RSB)/Return Address Injection, and Store To Load (STL)/Speculative Store Bypass.:TECHNIQUE:Exception/Fault-based - adversary has CPU execute transient instructions that raise an exception allowing inaccessible memory space to be accessed via out-of-order execution. These exception/fault-based methods include: Supervisor-only Bypass, Virtual Translation Bypass, System Register Bypass, FPU Register Bypass, Read-only Bypass, Protection Key Bypass, and Bounds Check Bypass.::STEP:1:PHASE:Exploit:DESCRIPTION:[Perform covert channel attack to obtain/access secret data] Adversary process code removes instructions/data from shared cache set, waits for target process to reinsert them back into cache, to identify location of secret data via a timing method. Adversary continuously repeat this process to identify and access entirety of targeted secret data.:TECHNIQUE:Flush+Reload - adversary frequently flushes targeted memory cache line using a dedicated machine flush instruction, and uses another process to measure time taken for CPU to load victim secret data.:TECHNIQUE:Evict+Time - adversary causes victim to load target set into cache and measures time for victim process to load this data, setting a baseline. Adversary evicts a specified cache line and causes victim process to execute again, and measures any change in execution time, to determine if cache line was accessed.:TECHNIQUE:Prime+Probe - adversary primes cache by filling cache line(s) or set(s) with data, after some time victim process evicts this adversary data to replace it with secret data. The adversary then probes/accesses all the previously accessed cache lines detecting cache misses, which determine that their attacker data has been evicted and replaced with secret data from victim process.::",::The adversary needs at least user execution access to a system and a maliciously crafted program/application/process with unprivileged code to misuse transient instruction set execution of the CPU.::,"::SKILL:Detailed knowledge on how various CPU architectures and microcode perform transient execution for various low-level assembly language code instructions/operations.:LEVEL:High::SKILL:Detailed knowledge on compiled binaries and operating system shared libraries of instruction sequences, and layout of application and OS/Kernel address spaces for data leakage.:LEVEL:High::","::C2C mechanism or direct access to victim system, capable of dropping malicious program and collecting covert channel attack data.::Malicious program capable of triggering execution of transient instructions or vulnerable instruction sequences of victim program and performing a covert channel attack to gather data from victim process memory space. Ultimately, the speed with which an attacker discovers a secret is directly proportional to the computational resources of the victim machine.::",::File Signatures for Malicious Software capable of abusing Transient Instruction Set Execution::,::SCOPE:Confidentiality:TECHNICAL IMPACT:Read Data::SCOPE:Access Control:TECHNICAL IMPACT:Bypass Protection Mechanism::SCOPE:Authorization:TECHNICAL IMPACT:Execute Unauthorized Commands::,::Implementation: DAWG (Dynamically Allocated Way Guard) - processor cache properly divided between different programs/processes that don't share resources::Implementation: KPTI (Kernel Page-Table Isolation) to completely separate user-space and kernel space page tables::Configuration: Architectural Design of Microcode to limit abuse of speculative execution and out-of-order execution::Configuration: Disable SharedArrayBuffer for Web Browsers::Configuration: Disable Copy-on-Write between Cloud VMs::Configuration: Privilege Checks on Cache Flush Instructions::Implementation: Non-inclusive Cache Memories to prevent Flush+Reload Attacks::,"::A web browser with user-privileges executes JavaScript code imbedded within a malicious website. The system does not disable shared buffers for the web browser and there is no restriction or check upon user-process execution of flush or evict instructions. The Javascript code executes vulnerable transient instructions upon system to cause microarchitectural changes that establish covert channel and transfer sensitive/secret data into shared cache from address space of either kernel, web browser or another executing process on the system.::",::1037::1303::1264::,,
Alteration of a Software Update,Standard,Draft,"An adversary with access to an organizations software update infrastructure inserts malware into the content of an outgoing update to fielded systems where a wide range of malicious effects are possible. With the same level of access, the adversary can alter a software update to perform specific malicious acts including granting the adversary control over the softwares normal functionality.",,Medium,High,::NATURE:ChildOf:CAPEC ID:184::NATURE:CanPrecede:CAPEC ID:673::,"::STEP:1:PHASE:Explore:DESCRIPTION:[Identify software with frequent updates] The adversary must first identify a target software that has updates at least with some frequency, enough that there is am update infrastructure.::STEP:2:PHASE:Experiment:DESCRIPTION:[Gain access to udpate infrastructure] The adversary must then gain access to the organization's software update infrastructure. This can either be done by gaining remote access from outside the organization, or by having a malicious actor inside the organization gain access. It is often easier if someone within the organization gains access.::STEP:3:PHASE:Exploit:DESCRIPTION:[Alter the software update] Through access to the software update infrastructure, an adversary will alter the software update by injecting malware into the content of an outgoing update.::",::An adversary would need to have penetrated an organizations software update infrastructure including gaining access to components supporting the configuration management of software versions and updates related to the software maintenance of customer systems.::,"::SKILL:Skills required include the ability to infiltrate the organizations software update infrastructure either from the Internet or from within the organization, including subcontractors, and be able to change software being delivered to customer/user systems in an undetected manner.:LEVEL:High::",,,::SCOPE:Access Control:TECHNICAL IMPACT:Gain Privileges::SCOPE:Authorization:TECHNICAL IMPACT:Execute Unauthorized Commands::SCOPE:Integrity:TECHNICAL IMPACT:Modify Data::SCOPE:Confidentiality:TECHNICAL IMPACT:Read Data::,"::Have a Software Assurance Plan that includes maintaining strict configuration management control of source code, object code and software development, build and distribution tools; manual code reviews and static code analysis for developmental software; and tracking of all storage and movement of code.::Require elevated privileges for distribution of software and software updates.::",::A subcontractor to a software developer injects maliciously altered software updates into an automated update process that distributes to government and commercial customers software containing a hidden backdoor.::,,TAXONOMY NAME:ATTACK:ENTRY ID:1195.002:ENTRY NAME:Supply Chain Compromise: Compromise Software Supply Chain::,
Software Development Tools Maliciously Altered,Detailed,Draft,"An adversary with the ability to alter tools used in a development environment causes software to be developed with maliciously modified tools. Such tools include requirements management and database tools, software design tools, configuration management tools, compilers, system build tools, and software performance testing and load testing tools. The adversary then carries out malicious acts once the software is deployed including malware infection of other systems to support further compromises.",,Low,High,::NATURE:ChildOf:CAPEC ID:444::NATURE:CanPrecede:CAPEC ID:669::,,"::An adversary would need to have access to a targeted developers development environment and in particular to tools used to design, create, test and manage software, where the adversary could ensure malicious code is included in software packages built through alteration or substitution of tools in the environment used in the development of software.::","::SKILL:Ability to leverage common delivery mechanisms (e.g., email attachments, removable media) to infiltrate a development environment to gain access to software development tools for the purpose of malware insertion into an existing tool or replacement of an existing tool with a maliciously altered copy.:LEVEL:High::",,,::SCOPE:Integrity:TECHNICAL IMPACT:Execute Unauthorized Commands::SCOPE:Access Control:TECHNICAL IMPACT:Gain Privileges::SCOPE:Confidentiality:TECHNICAL IMPACT:Modify Data:TECHNICAL IMPACT:Read Data::,"::Have a security concept of operations (CONOPS) for the development environment that includes: Maintaining strict security administration and configuration management of requirements management and database tools, software design tools, configuration management tools, compilers, system build tools, and software performance testing and load testing tools.::Avoid giving elevated privileges to developers.::",::An adversary with access to software build tools inside an Integrated Development Environment IDE alters a script used for downloading dependencies from a dependent code repository where the script has been changed to include malicious code implanted in the repository by the adversary.::,,TAXONOMY NAME:ATTACK:ENTRY ID:1127:ENTRY NAME:Trusted Developer Utilities Proxy Execution::::TAXONOMY NAME:ATTACK:ENTRY ID:1195.001:ENTRY NAME:Supply Chain Compromise: Compromise Software Dependencies and Development Tools::,
Requirements for ASIC Functionality Maliciously Altered,Detailed,Draft,"An adversary with access to functional requirements for an application specific integrated circuit (ASIC), a chip designed/customized for a singular particular use, maliciously alters requirements derived from originating capability needs. In the chip manufacturing process, requirements drive the chip design which, when the chip is fully manufactured, could result in an ASIC which may not meet the users needs, contain malicious functionality, or exhibit other anomalous behaviors thereby affecting the intended use of the ASIC.",,Low,High,::NATURE:ChildOf:CAPEC ID:447::,,"::An adversary would need to have access to a foundrys or chip makers requirements management system that stores customer requirements for ASICs, requirements upon which the design of the ASIC is based.::",::SKILL:An adversary would need experience in designing chips based on functional requirements in order to manipulate requirements in such a way that deviations would not be detected in subsequent stages of ASIC manufacture and where intended malicious functionality would be available to the adversary once integrated into a system and fielded.:LEVEL:High::,,,::SCOPE:Integrity:TECHNICAL IMPACT:Alter Execution Logic::,"::Utilize DMEAs (Defense Microelectronics Activity) Trusted Foundry Program members for acquisition of microelectronic components.::Ensure that each supplier performing hardware development implements comprehensive, security-focused configuration management including for hardware requirements and design.::Require that provenance of COTS microelectronic components be known whenever procured.::Conduct detailed vendor assessment before acquiring COTS hardware.::","::An adversary with access to ASIC functionality requirements for various customers, targets a particular customers ordered lot of ASICs by altering its functional requirements such that the ASIC design will result in a manufactured chip that does not meet the customers capability needs.::",,TAXONOMY NAME:ATTACK:ENTRY ID:1195.003:ENTRY NAME:Supply Chain Compromise: Compromise Hardware Supply Chain::,
Malicious Code Implanted During Chip Programming,Detailed,Draft,"During the programming step of chip manufacture, an adversary with access and necessary technical skills maliciously alters a chips intended program logic to produce an effect intended by the adversary when the fully manufactured chip is deployed and in operational use. Intended effects can include the ability of the adversary to remotely control a host system to carry out malicious acts.",,Low,High,::NATURE:ChildOf:CAPEC ID:444::,,"::An adversary would need to have access to a foundrys or chip makers development/production environment where programs for specific chips are developed, managed and uploaded into targeted chips prior to distribution or sale.::","::SKILL:An adversary needs to be skilled in microprogramming, manipulation of configuration management systems, and in the operation of tools used for the uploading of programs into chips during manufacture. Uploading can be for individual chips or performed on a large scale basis.:LEVEL:Medium::",,,::SCOPE:Integrity:TECHNICAL IMPACT:Alter Execution Logic::,"::Utilize DMEAs (Defense Microelectronics Activity) Trusted Foundry Program members for acquisition of microelectronic components.::Ensure that each supplier performing hardware development implements comprehensive, security-focused configuration management of microcode and microcode generating tools and software.::Require that provenance of COTS microelectronic components be known whenever procured.::Conduct detailed vendor assessment before acquiring COTS hardware.::","::Following a chips production process steps of test and verification and validation of chip circuitry, an adversary involved in the generation of microcode defining the chips function(s) inserts a malicious instruction that will become part of the chips program. When integrated into a system, the chip will produce an effect intended by the adversary.::",,TAXONOMY NAME:ATTACK:ENTRY ID:1195.003:ENTRY NAME:Supply Chain Compromise: Compromise Hardware Supply Chain::,
Developer Signing Maliciously Altered Software,Detailed,Draft,"Software produced by a reputable developer is clandestinely infected with malicious code and then digitally signed by the unsuspecting developer, where the software has been altered via a compromised software development or build process prior to being signed. The receiver or user of the software has no reason to believe that it is anything but legitimate and proceeds to deploy it to organizational systems. This attack differs from CAPEC-206, since the developer is inadvertently signing malicious code they believe to be legitimate and which they are unware of any malicious modifications.",,Medium,High,::NATURE:ChildOf:CAPEC ID:444::,,"::An adversary would need to have access to a targeted developers software development environment, including to their software build processes, where the adversary could ensure code maliciously tainted prior to a build process is included in software packages built.::","::SKILL:The adversary must have the skills to infiltrate a developers software development/build environment and to implant malicious code in developmental software code, a build server, or a software repository containing dependency code, which would be referenced to be included during the software build process.:LEVEL:High::",,,::SCOPE:Integrity:SCOPE:Confidentiality:TECHNICAL IMPACT:Read Data:TECHNICAL IMPACT:Modify Data::SCOPE:Access Control:SCOPE:Authorization:TECHNICAL IMPACT:Gain Privileges:TECHNICAL IMPACT:Execute Unauthorized Commands::,"::Have a security concept of operations (CONOPS) for the IDE that includes: Protecting the IDE via logical isolation using firewall and DMZ technologies/architectures; Maintaining strict security administration and configuration management of configuration management tools, developmental software and dependency code repositories, compilers, and system build tools.::Employ intrusion detection and malware detection capabilities on IDE systems where feasible.::","::An adversary who has infiltrated an organizations build environment maliciously alters code intended to be included in a products software build via software dependency inclusion, part of the software build process. When the software product has been built, the developer electronically signs the finished product using their signing key. The recipient of the software product, an end user/customer, believes the software to reflect the developers intent with respect to functionality unaware of the adversarys malicious intent harbored within.::",,TAXONOMY NAME:ATTACK:ENTRY ID:1195.002:ENTRY NAME:Supply Chain Compromise: Compromise Software Supply Chain::,
Design for FPGA Maliciously Altered,Detailed,Stable,"An adversary alters the functionality of a field-programmable gate array (FPGA) by causing an FPGA configuration memory chip reload in order to introduce a malicious function that could result in the FPGA performing or enabling malicious functions on a host system. Prior to the memory chip reload, the adversary alters the program for the FPGA by adding a function to impact system operation.",,Low,High,::NATURE:ChildOf:CAPEC ID:447::,,::An adversary would need to have access to FPGA programming/configuration-related systems in a chip makers development environment where FPGAs can be initially configured prior to delivery to a customer or have access to such systems in a customer facility where end-user FPGA configuration/reconfiguration can be performed.::,"::SKILL:An adversary would need to be skilled in FPGA programming in order to create/manipulate configurations in such a way that when loaded into an FPGA, the end user would be able to observe through testing all user-defined required functions but would be unaware of any additional functions the adversary may have introduced.:LEVEL:High::",,,::SCOPE:Integrity:TECHNICAL IMPACT:Alter Execution Logic::,"::Utilize DMEAs (Defense Microelectronics Activity) Trusted Foundry Program members for acquisition of microelectronic components.::Ensure that each supplier performing hardware development implements comprehensive, security-focused configuration management including for FPGA programming and program uploads to FPGA chips.::Require that provenance of COTS microelectronic components be known whenever procured.::Conduct detailed vendor assessment before acquiring COTS hardware.::","::An adversary with access and the ability to alter the configuration/programming of FPGAs in organizational systems, introduces a trojan backdoor that can be used to alter the behavior of the original system resulting in, for example, compromise of confidentiality of data being processed.::",,TAXONOMY NAME:ATTACK:ENTRY ID:1195.003:ENTRY NAME:Supply Chain Compromise: Compromise Hardware Supply Chain::,
Retrieve Data from Decommissioned Devices,Standard,Stable,"An adversary obtains decommissioned, recycled, or discarded systems and devices that can include an organizations intellectual property, employee data, and other types of controlled information. Systems and devices that have reached the end of their lifecycles may be subject to recycle or disposal where they can be exposed to adversarial attempts to retrieve information from internal memory chips and storage devices that are part of the system.",,Medium,Medium,::NATURE:ChildOf:CAPEC ID:116::NATURE:CanPrecede:CAPEC ID:37::,,"::An adversary needs to have access to electronic data processing equipment being recycled or disposed of (e.g., laptops, servers) at a collection location and the ability to take control of it for the purpose of exploiting its content.::","::SKILL:An adversary may need the ability to mount printed circuit boards and target individual chips for exploitation.:LEVEL:High::SKILL:An adversary needs the technical skills required to extract solid state drives, hard disk drives, and other storage media to host on a compatible system or harness to gain access to digital content.:LEVEL:Medium::",,,::SCOPE:Accountability:TECHNICAL IMPACT:Bypass Protection Mechanism::,"::Backup device data before erasure to retain intellectual property and inside knowledge.::Overwrite data on device rather than deleting. Deleted data can still be recovered, even if the device trash can is emptied. Rewriting data removes any trace of the old data. Performing multiple overwrites followed by a zeroing of the device (overwriting with all zeros) is good practice.::Use a secure erase software.::Physically destroy the device if it is not intended to be reused. Using a specialized service to disintegrate, burn, melt or pulverize the device can be effective, but if those services are inaccessible, drilling nails or holes, or smashing the device with a hammer can be effective. Do not burn, microwave, or pour acid on a hard drive.::Physically destroy memory and SIM cards for mobile devices not intended to be reused.::Ensure that the user account has been terminated or switched to a new device before destroying.::","::A company is contracted by an organization to provide data destruction services for solid state and hard disk drives being discarded. Prior to destruction, an adversary within the contracted company copies data from select devices, violating the data confidentiality requirements of the submitting organization.::",::1266::,TAXONOMY NAME:ATTACK:ENTRY ID:1052:ENTRY NAME:Exfiltration Over Physical Medium::,
Server Motherboard Compromise,Detailed,Draft,"Malware is inserted in a server motherboard (e.g., in the flash memory) in order to alter server functionality from that intended. The development environment or hardware/software support activity environment is susceptible to an adversary inserting malicious software into hardware components during development or update.",,Low,High,::NATURE:ChildOf:CAPEC ID:534::,,::An adversary with access to hardware/software processes and tools within the development or hardware/software support environment can insert malicious software into hardware components during development or update/maintenance.::,,,,::SCOPE:Integrity:TECHNICAL IMPACT:Execute Unauthorized Commands::,"::Purchase IT systems, components and parts from government approved vendors whenever possible.::Establish diversity among suppliers.::Conduct rigorous threat assessments of suppliers.::Require that Bills of Material (BoM) for critical parts and components be certified.::Utilize contract language requiring contractors and subcontractors to flow down to subcontractors and suppliers SCRM and SCRA (Supply Chain Risk Assessment) requirements.::Establish trusted supplier networks.::","::Malware is inserted into the Unified Extensible Firmware Interface (UEFI) software that resides on a flash memory chip soldered to a computers motherboard. It is the first thing to turn on when a system is booted and is allowed access to almost every part of the operating system. Hence, the malware will have extensive control over operating system functions and persist after system reboots. [REF-685]::",,TAXONOMY NAME:ATTACK:ENTRY ID:1195.003:ENTRY NAME:Supply Chain Compromise: Compromise Hardware Supply Chain::,
